judul_berita,penulis_berita,url_berita,media_online,tanggal_berita_dt,source_domain,artikel_berita,status,error,is_empty
"Mentrans Sambangi Perkampungan Transmigrasi di Salor Merauke, Janji Tuntaskan Masalah Laha...",Tidak Diketahui,https://www.liputan6.com/news/read/6165034/mentrans-sambangi-perkampungan-transmigrasi-di-salor-merauke-janji-tuntaskan-masalah-lahan,liputan6,2025-09-21 21:31:17+07:00,www.liputan6.com,"Liputan6.com, Jakarta - Menteri Transmigrasi ( Mentrans ), Muhammad Iftitah Sulaiman Suryanagara mendatangi lokasi transmigrasi di Desa Salor Indah, Merauke , Papua Selatan. Iftitah menyempatkan diri bertemu langsung dengan warga transmigrasi, masyarakat lokal dan Tim Ekspedisi Patriot (TEP).
Iftitah mengatakan, dari pertemuan dan dialog bersama, terdapat beberapa persoalan dan masukan kepada Kementerian Transmigrasi. Adapun persoalan pertama yakni terkait permasalahan lahan di lokasi transmigrasi.
Rencana Kementrans Bakal Bangun Mess Patriot di Kawasan Transmigrasi Salor Merauke, Yakin Diminati
Rencana Kementrans Bakal Bangun Mess Patriot di Kawasan Transmigrasi Salor Merauke, Yakin Diminati
Menteri Transmigrasi Kagumi Transformasi Desa Ponggok, dari Tertinggal Jadi Ikon Wisata
Menteri Transmigrasi Kagumi Transformasi Desa Ponggok, dari Tertinggal Jadi Ikon Wisata
Mentrans Iftitah Puji Talenta Siswa SMA Pradipta Dirgantara, Harap Jadi Penggerak Ekonomi Baru
Mentrans Iftitah Puji Talenta Siswa SMA Pradipta Dirgantara, Harap Jadi Penggerak Ekonomi Baru
""Ini adalah persoalan yang cukup mengungkap, oleh karena itu kenapa kami dalam program unggulan pertama, Kementerian Transmigrasi adalah masalah penyelesaian lahan melalui program transmigrasi,"" ujar Iftitah, Minggu (21/9/2025).
Iftitah menjelaskan, pada penanganan persoalan lahan, Kementerian Transmigrasi berusaha menyelesaikan dan menuntaskan persoalan lahan. Menurutnya, apabila persoalan lahan harus dituntaskan menggunakan anggaran, Kementerian Transmigrasi akan menggunakan penganggaran.
""Jadi solusi kami adalah selesaikan, tuntaskan. Tuntaskan dalam arti kalau misalkan memang harus dianggarkan, kita anggarkan. Kita lakukan kolaborasi juga dengan Kementerian ATR BPN,"" jelas Iftitah.
Iftitah menegaskan, Kementerian Transmigrasi akan melakukan upaya mencari solusi terbaik dalam menyelesaikan lahan. Tahun ini Kementerian Transmigrasi akan menyelesaikan lahan dengan target 13 ribu bidang.
""Sudah lebih dari 6 ribu bidang yang kami selesaikan, dan ada 2 ribu bidang lain yang masih siap terima aktivitas, sehingga kami optimis jika kita serius menyelesaikan persoalan lahan ini, nanti pelan-pelan kita akan bisa lakukan solusi yang terbaik,"" tegas Iftitah.
Kementerian Transmigrasi turut menerima masukan dari TEP yang bertugas di kawasan transmigrasi Desa Salor Indah. Adapun masukan yang diberikan terkait dengan potensi yang ada di kawasan transmigrasi.
""Jadi tidak hanya pertanian, mereka juga mengusulkan agar dikembangkan juga, terkait dengan peternakan. Oleh karena itu nanti akan kami lakukan upaya-upaya,"" ucap Iftitah.
Kementerian Transmigrasi akan berupaya mengundang investor dari Brazil untuk pengembangan ekonomi di kawasan transmigrasi Salor Indah. Kementerian Transmigrasi sedang melakukan berbagai upaya sehingga menarik investor turut mengembangkan kawasan transmigrasi.
""Kami ke depan akan menseriusi langkah-langkah ini, supaya investor tersebut bisa datang hadir ke kawasan Salor ini,"" terang Iftitah.
Iftitah mengungkapkan, Kementerian Transmigrasi telah membuat rencana dengan Gubernur Papua Selatan. Adapun rencana yang sedang dibuat yakni membuat kawasan pendidikan terintegrasi.
""Kita semua menginginkan Merauke ini sebagai satu kota pendidikan, agar ada satu kawasan yang terintegrasi, di mana nanti tidak hanya SD, SMP, SMA sampai dengan keperguruan tingginya, bisa menjadi salah satu role model dan menjadi rujukan bagi kota-kota lain yang ada di Papua,"" ungkap Iftitah.
Kementerian Transmigrasi turut memikirkan pentingnya kelembagaan ekonomi, di antaranya Koperasi Merah Putih. Meskipun begitu, Iftitah mengakui terdapat kekurangan dalam pengembangan ekonomi pada kawasan transmigrasi, yakni teknologi, akses modal, dan konten.
""Nah inilah yang nanti akan kita kolaborasikan antara dunia usaha dengan kepentingan transmigrasi."" Kata Iftitah.
Iftitah menuturkan, Kementerian Transmigrasi berencana mengembangkan kapasitas Patriot yang ada di Salor Indah. Kementerian Transmigrasi berusaha dengan adanya TEP dapat menjadi bagian integral dengan rencana pengembangan di Provinsi Papua Selatan.
""Kita berharap nanti ada satu ekosistem yang terbaik untuk meningkatkan pertumbuhan ekonomi di Merauke ini, khususnya di kawasan transmigrasi di Salor,"" pungkas Iftitah.",ok_site_specific,,False
Fenomena Lock-In Season: Tren Kejar Target Akhir Tahun yang Berisiko Burnout,Tidak Diketahui,https://www.liputan6.com/bisnis/read/6163805/fenomena-lock-in-season-tren-kejar-target-akhir-tahun-yang-berisiko-burnout,liputan6,2025-09-21 06:00:40+07:00,www.liputan6.com,"Liputan6.com, Jakarta - Belakangan ini jamak profesional ambisius memilih start lebih awal untuk resolusi Tahun Baru mereka. Dari September hingga Desember, muncul tren di media sosial bernama lock-in season atau musim penguncian, merupakan tren di mana pekerja berkomitmen fokus pada tujuan kebugaran, keuangan, maupun karier di akhir tahun.
Bagi konsultan karier Khadyajah Jenkins, tren ini sebenarnya bukan hal baru. "" Lock-in season hanya konsep kuartal IV di kalender korporasi yang dikemas ulang untuk media sosial,"" Ungkap mantan perekrut teknologi yang kini menempuh studi doktoral di Penn State, dikutip dari CNBC , Sabtu (20/9/2025).
Kerja Keras Tak Bakal Khianati Hasil Itu Mitos, Begini Kata Pakar Karier Stanford
Kerja Keras Tak Bakal Khianati Hasil Itu Mitos, Begini Kata Pakar Karier Stanford
Berbagi Cerita Profesi, Orangtua Bantu Anak Kenali Ragam Karier Sejak Bangku Sekolah
Berbagi Cerita Profesi, Orangtua Bantu Anak Kenali Ragam Karier Sejak Bangku Sekolah
Tak Perlu Kampus Elit, Sukses Ditentukan dari Hal Ini
Tak Perlu Kampus Elit, Sukses Ditentukan dari Hal Ini
Meskipun begitu, Jenkins menilai periode ini tetap menjadi momen tepat untuk fokus pada idealisme yang disengaja untuk masa depan, mulai dari mengamankan promosi hingga mengembangkan kemampuan pribadi.
Ia bahkan membagikan strategi memanfaatkan tren ini di akun TikTok miliknya yang memiliki lebih dari 60 ribu pengikut.
Menurut pelatih para eksekutif perusahaan, Allie Stark, lock-in season ditandai dengan meningkatnya“disiplin dan momentum. Menjelang akhir tahun, banyak orang terdorong untuk bekerja ekstra keras demi menuntaskan target tahunan mereka.
“Ada energi seperti, ‘Saya sudah punya target di awal tahun, sekarang tersisa empat bulan untuk mencapainya, jadi bagaimana saya bisa mewujudkannya?’” kata Stark.
Bagi para profesional muda, karier menjadi prioritas utama dalam tren ini. Pelatih karier sekaligus juru bicara Resume.AI, Amanda Augustine, mengatakan berdasarkan analisis konten lock-in season di media sosial, banyak pekerja yang fokus memperbarui profil LinkedIn, melihat lagi pencapaian, hingga mengasah keterampilan menjelang tahun baru.
Di tengah pasar tenaga kerja yang menantang, para pekerja ingin memaksimalkan keamanan pekerjaan mereka.
“Semua orang membaca berita soal PHK dan bertanya, ‘Bagaimana caranya saya menjadi sekreatif dan seberharga mungkin?’” kata Augustine.
“Jika ada peluang yang belum mereka coba sebelumnya, sekarang mereka berusaha ke arah itu dan memanfaatkannya.”
Meski tren ini terdengar positif, ada potensi jebakan yang perlu diwaspadai.
Menurut Stark, lock-in season berakar pada keinginan untuk merasa aman dan terkendali di tengah ketidakpastian kolektif.
Godaan tenggelam dalam pekerjaan memang besar, namun dorongan berlebihan justru membuka risiko burnout . Karena itu, Stark menekankan pentingnya menetapkan target yang realistis dan terukur.
“Penting untuk sadar bahwa pencapaian itu tidak selalu linear,” katanya.
“Ketika ingin mencapai target, melakukan perubahan perilaku, atau membentuk kebiasaan baru, semua itu tidak bisa terjadi dalam semalam,” tambah dia.
Jenkins menambahkan, keberlanjutan harus menjadi fokus utama dalam menjalani lock-in season . Menurutnya, banyak nasihat di media sosial justru cenderung hanya gimmick belaka.
“Orang-orang langsung tancap gas tanpa memikirkan, minggu pertama akan seperti apa? Minggu kedua bagaimana? Apakah ini bisa berkelanjutan jangka panjang?” ujarnya.
Ia menyarankan pendekatan berupa sprint dua minggu: fokus bekerja keras dalam periode tersebut, lalu menganalisis hasil untuk dijadikan dasar strategi dua minggu berikutnya.
“Melihatnya lewat kerangka strategis membuat orang untuk lebih berhati-hati,” kata Jenkins.
Sama pentingnya, setelah setiap sprint, seseorang perlu berhenti sejenak untuk refleksi: “Kamu harus memberi waktu untuk berpikir, apa yang sebenarnya kamu inginkan.”
Meski lock-in season menekankan pencapaian target akhir tahun, Stark mengingatkan agar tidak memaksakan diri menyelesaikan semua daftar tugas sekaligus.
“Kita hidup di budaya yang lupa bahwa hal-hal baik membutuhkan waktu,” ujarnya.
“Rasanya menyenangkan saat motivasi meningkat, dan saya setuju memulai musim gugur dengan semangat. Tapi harus ada keseimbangan dengan melakukan cek ke dalam diri sendiri,” tambahnya.",ok_site_specific,,False
Anyaman Kebumen Go International! Taklukkan Amerika - EropaResearch4 menit yang lalu,Tidak Diketahui,https://www.cnbcindonesia.com/research/20250918165138-128-668258/anyaman-kebumen-go-international-taklukkan-amerika--eropa,cnbc,2025-09-22 00:00:00+07:00,www.cnbcindonesia.com,"Anyaman Kebumen Go International! Taklukkan Amerika - Eropa
Jakarta,CNBC Indonesia- Sebuah langkah penting dicatatkan dari Kebumen, Jawa Tengah. Untuk pertama kalinya, produk kerajinan berbahan serat alam asal daerah itu berhasil menembus pasar Amerika Serikat (AS).
PT AgrominaFiber Java Indonesia, UMKM binaan Yayasan Pertamina, mengirim enam kontainer berisi 9.000 keranjang berbahan pelepah pisang dan eceng gondok dengan nilai US$57.200 atau setara Rp937 juta.
Pelepasan ekspor perdana ini dilakukan secara daring pada Selasa (16/9) oleh Direktur Jenderal Pengembangan Ekspor Nasional (PEN) Kementerian Perdagangan, Fajarini Puntodewi.
Dia menegaskan, capaian tersebut menjadi bukti bahwa produk UMKM Indonesia mampu bersaing di pasar global, khususnya pada kategori kerajinan ramah lingkungan. ""Dari Kebumen, kita bisa menghadirkan karya lokal yang kompetitif, berkelanjutan, dan diminati pasar dunia,"" ujarnya.
Keberhasilan ini berawal dari partisipasi PT AgrominaFiber dalam Trade Expo Indonesia (TEI) 2024. Dari ajang itu, transaksi bisnis berkembang hingga menjadi pengiriman nyata ke AS.
Direktur perusahaan, Rudi Hermawan, menekankan bahwa daya tarik produk mereka terletak pada tekstur serta warna alami hasil anyaman, yang semakin relevan dengan tren konsumen global yang mencari produk berkelanjutan.
Di Kebumen sendiri, ekspor ini membuka peluang kerja baru. Lebih dari 300 perajin lokal di berbagai desa kini terlibat dalam rantai produksi, memperkuat dampak ekonomi langsung bagi masyarakat.
Bupati Kebumen Lilis Nuryani menilai capaian ini akan menempatkan Kebumen sebagai salah satu basis produksi ekspor kerajinan yang mengangkat potensi lokal sekaligus meningkatkan kesejahteraan warga.
Sebelumnya, PT AgrominaFiber telah menembus pasar Dubai, Belgia, Nigeria, dan Cile. Target ke depan adalah memperluas pasar, meningkatkan repeat order dari mitra AS, serta mengembangkan produk baru seperti topi anyaman.",ok_trafilatura,,False
Waka MPR Tegaskan 4 Pilar Kebangsaan Acuan Lengkap Kehidupan Bernegara,Tidak Diketahui,https://news.detik.com/berita/d-8123317/waka-mpr-tegaskan-4-pilar-kebangsaan-acuan-lengkap-kehidupan-bernegara,detik,2025-09-21 00:00:00+07:00,news.detik.com,"Wakil Ketua MPR RI Lestari Moerdijat (Rerie) menekankan Empat Pilar Kebangsaan merupakan acuan yang lengkap untuk menjalani kehidupan berbangsa dan bernegara yang diamanahkan para pendahulu bangsa. Empat Pilar MPR RI terdiri dari Pancasila, Undang-Undang Dasar (UUD) 1945, Negara Kesatuan Republik Indonesia (NKRI), dan Bhinneka Tunggal Ika.
""Nilai-nilai Pancasila sebagai jiwa kita, UUD 1945 sebagai aturan yang harus dipatuhi, Negara Kesatuan Republik Indonesia (NKRI) sebagai wilayah hidup kita, dan Bhinneka Tunggal Ika merupakan kekuatan yang kita miliki dalam kehidupan berbangsa dan bernegara yang kita jalani,"" kata Rerie, dalam keterangannya, Minggu (21/9/2025).
Pernyataan itu disampaikan Rerie pada acara Sosialisasi Empat Pilar MPR RI di depan generasi muda dan masyarakat kota Medan di Yayasan Prananda Surya Paloh, di Medan, Sumatera Utara (Sumut), Sabtu (20/9). Menurut Rerie, menghadapi dinamika global dan disrupsi teknologi, dibutuhkan sebuah kesadaran bersama untuk berpegang teguh pada Pancasila, UUD 1945, NKRI dan Bhinneka Tunggal Ika sebagai fondasi kehidupan.
SCROLL TO CONTINUE WITH CONTENT
""Empat Pilar Kebangsaan yang kita miliki itu ibarat game atau sebuah aplikasi. Pancasila itu, tambahnya, ibarat aplikasi utama yang ada di HP kita,"" kata Rerie
Sila-sila di dalamnya, sila 1 sampai 5 itu, jelas Rerie, adalah fitur-fitur yang membantu seseorang untuk memahami sekaligus berfungsi sebagai filter dalam kehidupan bernegara.
Menurut Rerie, nilai-nilai kearifan lokal Sumut seperti Marsiadapari (gotong royong), juga harus terus dihidupkan untuk membangkitkan solidaritas dan toleransi, serta kepedulian di antara sesama anak bangsa. Rerie menambahkan keutuhan wilayah NKRI, sejatinya ada di tangan setiap anak bangsa.
""Karena kita punya kekuatan yang bernama Bhineka Tunggal Ika, meski berbeda-beda kita tetap satu,"" ujar Anggota Majelis Tinggi Partai NasDem itu.
Sebelumnya, Rerie membuka acara Lomba Cerdas Cermat Empat Pilar MPR RI Tahun 2025 Provinsi Sumut. Pada kesempatan itu, Rerie berpesan kepada para peserta cerdas cermat agar menjadi insan yang qualified yaitu insan yang tahu kalau dia tahu dan harus tahu kalau dia tidak tahu.
Sehingga, tegas Rerie, insan yang qualified itu selalu berupaya untuk mencari tahu atau berkolaborasi dengan orang yang tahu agar mampu memecahkan berbagai masalah yang dihadapi.
""Sebuah keberhasilan adalah jika mampu bersatu dan mampu memecahkan persoalan dengan pendekatan berbagai sudut pandang, karena itu persatuan bangsa menjadi suatu hal yang harus terus diwujudkan,"" pungkasnya.",ok_site_specific,,False
"IAGI: Gag Nikel Raja Ampat Beroperasi Lagi, Cadangannya Sumbang Hilirisasi",Tidak Diketahui,https://www.liputan6.com/bisnis/read/6165503/iagi-gag-nikel-raja-ampat-beroperasi-lagi-cadangannya-sumbang-hilirisasi,liputan6,2025-09-22 15:30:08+07:00,www.liputan6.com,"Liputan6.com, Jakarta - PT Gag Nikel di Raja Ampat, Papua Barat Daya telah resmi beroperasi kembali sejak pekan lalu. Cadangan yang dimilikinya disebut bisa menyumbang hilirisasi nasional.
Ketua Umum Ikatan Ahli Geologi Indonesia (IAGI), Budi Santoso menyampaikan pemanfaatan nikel di wilayah sensitif seperti daerah operasi GAG memang perlu dijalankan secara hati-hati. Termasuk dikawal oleh koridor dokumen studi kelayakan (FS), analisis mengenai dampak lingkungan (Amdal), izin lingkungan, dan dokumen pendukung lainnya.
Gag Nikel Harus Penuhi Aturan Ini Setelah Kembali Beroperasi
Gag Nikel Harus Penuhi Aturan Ini Setelah Kembali Beroperasi
""Mendapatkan dan mengelola social license to operate juga jadi krusial. Penerapan secara ketat dan konsisten dari good mining practices selama beroperasi hingga pasca-operasi akan menjadi kunci keberlanjutan operasi,” kata Budi dalam keterangan resmi, Senin (22/9/2025).
Ia mengakui, cadangan di wilayah operasional GAG berpotensi menyumbang hilirisasi . Ini juga menandakan adanya sumber lain pemanfaatan nikel nasional.
""Cadangan PT GAG bersama yang lainnya akan memberikan kontribusi bagi inventarisasi cadangan nikel nasional sebagai modal penyediaan bahan baku penting dalam rantai nilai hilirisasi,” ucapnya.
Dia menilai, perlu ada fleksibilitas dan ketahanan pasokan sesuai kebutuhan pasar dan ketersediaan atau pemilihan teknologi pemrosesan yang digunakan demi menjaga produksi sekaligus konservasi wilayah. Hal ini penting untuk diperhatikan pemerintah hingga pelaku industri.
""Pendetilan karakteristik bijih termasuk by product-nya, baik dari sifat fisik, kadar, dan kandungan unsur kimia, akan memungkinkan optimalisasi pemanfaatan sumber daya dan cadangan,"" ujar dia.
Diberitakan sebelumnya, Kementerian Energi dan Sumber Daya Mineral (ESDM) memastikan bahwa PT GAG Nikel di Raja Ampat, Papua Barat Daya, telah kembali beroperasi.
""Sudah, setahu saya. Per hari Rabu,” ujar Direktur Jenderal Mineral dan Batu Bara Kementerian ESDM, Tri Winarno, dikutip dari Antara, Jumat (12/9/2025).
Hasil evaluasi Program Penilaian Kinerja Perusahaan (PROPER) menunjukkan PT GAG Nikel berhasil meraih peringkat hijau. Artinya, perusahaan telah mematuhi tata kelola lingkungan sekaligus menjalankan program pemberdayaan masyarakat.
""(Keputusannya) lintas kementerian, sama KLH (Kementerian Lingkungan Hidup) dan KKP (Kementerian Kelautan dan Perikanan),” tambahnya.
PT Gag Nikel kembali beroperasi di Raja Ampat, Papua Barat Daya. Seiring hal itu, Kementerian Lingkungan Hidup mengatur batasan-batasan untuk PT Gag Nikel supaya tidak menyebabkan pencemaran lingkungan.
Hal itu disampaikan Menteri Lingkungan Hidup Hanif Faisol Nurofiq seperti dikutip dari Antara, Minggu (14/9/2025).
""Pertama yang paling krusial adalah (PT GAG Nikel) tidak boleh ada surface runoff (limpasan permukaan) yang boleh jatuh langsung ke badan sungai atau badan air, sehingga settling pond (kolam pengendapan) itu dibikin presisi,” ujar Hanif di Denpasar, Bali, Minggu, 14 September 2025.
Pemerintah mengatur perusahaan tambang tersebut membangun banyak tahapan kolam pengendapan supaya saat terjadi hujan yang membawa air larian bukaan tambang tidak langsung jatuh ke badan sungai.
""Ini untuk menjamin tidak ada air larian dari bukaan tambang yang menyebabkan sedimentasi dan kekeruhan, itu yang penting,” kata Menteri Hanif.
Selain itu, pemerintah mengatur agar perusahaan tersebut emisi yang dihasilkannya bisa terus dikontrol.
""Tingkat emisi kami kontrol, jadi kami wajibkan dipasang stasiun pengendali kualitas udara di sana untuk memastikan bahwa emisi yang dikeluarkan di bawah baku mutu,” Hanif menambahkan.",ok_site_specific,,False
"DPR Usul Penggunaan Patwal dan Strobo Cuma Khusus Pimpinan Lembaga Negara, Artis atau Lain...",Tidak Diketahui,https://www.liputan6.com/news/read/6165478/dpr-usul-penggunaan-patwal-dan-strobo-cuma-khusus-pimpinan-lembaga-negara-artis-atau-lainnya-dilarang,liputan6,2025-09-22 14:14:39+07:00,www.liputan6.com,"Liputan6.com, Jakarta Anggota Komisi III DPR Sarifuddin Sudding menegaskan, pihaknya mendukung kepolisian menghentikan pemberian patroli pengawalan ( patwal ) dan strobo ke sembarang orang. Sudding mengusulkan, hanya pemimpin lembaga negara yang boleh diberi Patwal.
“Pemakaian seperti ini paling tidak hanya sebatas pada pimpinan-pimpinan negara, katakanlah seperti itu betul-betul dibatasi, diperketat sedemikian rupa penggunaan strobo,” kata Sudding di Kompleks Parlemen Senayan, Jakarta, Senin (22/9/2025).
Puan Sebut DPR Bangga Prabowo Wakili RI Dorong Kemerdekaan Palestina di Sidang PBB
Puan Sebut DPR Bangga Prabowo Wakili RI Dorong Kemerdekaan Palestina di Sidang PBB
Said Abdullah: RAPBN 2026 Alat Perangi Kemiskinan dan Krisis Iklim
Said Abdullah: RAPBN 2026 Alat Perangi Kemiskinan dan Krisis Iklim
Menkeu Purbaya Soal Bansos: Untung Ada DPR, Jadi Enggak Koboi Banget
Menkeu Purbaya Soal Bansos: Untung Ada DPR, Jadi Enggak Koboi Banget
Sudding juga meminta pemberian pengawalan pada para artis atau pihak lain di luar lembaga negara untuk dihentikan.
""Nah ini yang menurut saya perlu dihentikan, segera dihentikan hal-hal seperti itu, saya kira ini yang banyak mengganggu,” ungkapnya.
Sudding mengaku anggota Dewan tidak menggunakan pengawalan atau strobo. Legislator yang boleh menggunakan strobo hanya pimpinan DPR.
“Enggak, hanya pimpinan DPR,” pungkasnya.
Sebelumnya, Korlantas Polri mengeluarkan kebijakan membekukan penggunaan sirine, strobo, dan rotator dalam kegiatan pengawalan kendaraan pejabat yang dianggap tidak mendesak atau bukan prioritas. Kebijakan tersebut diambil sebagai respons atas keluhan masyarakat yang merasa terganggu dengan suara bising dan kilatan lampu yang kerap digunakan berlebihan di jalan raya.
""Saya bekukan untuk pengawalan menggunakan suara-suara itu,"" tutur Kakorlantas Polri Irjen Agus Suryonugroho di Mabes Polri, Jakarta Selatan, pada Jumat (22/9/2025) kemarin.",ok_site_specific,,False
"Kevin Diks Bangga Borussia Monchengladbach Imbangi Bayer Leverkusen di Kandang Lawan, Singgung soal Karakter",Tidak Diketahui,https://bola.okezone.com/read/2025/09/22/51/3171629/kevin-diks-bangga-borussia-monchengladbach-imbangi-bayer-leverkusen-di-kandang-lawan-singgung-soal-karakter,okezone,2025-09-22 13:24:00+07:00,bola.okezone.com,"Kevin Diks bangga betul Borussia Monchengladbach bisa mencuri poin di markas Bayer Leverkusen (Foto: Instagram/@kevindiks2)
LEVERKUSEN – Kevin Diks bangga betul Borussia Monchengladbach bisa mencuri poin di markas Bayer Leverkusen. Ia merasa timnya telah menunjukkan karakter yang sesungguhnya usai imbang 1-1.
Laga Bayer Leverkusen vs Borussia Monchengladbach itu merupakan spieltag 4 Liga Jerman 2025-2026. Duel berlangsung di Stadion BayArena, Leverkusen, Jerman, Minggu 21 September 2025 malam WIB.
Leverkusen unggul duluan lewat gol Malik Tillman (72’). Namun, Monchengladbach memaksakan hasil imbang 1-1 via gol Haris Tabakovic (90+2’).
Usai laga, Diks sangat bangga dengan karakter yang ditunjukkan Monchengladbach. Pemain berlabel Timnas Indonesia itu juga memuji dukungan para suporter yang tandang ke markas Leverkusen.
“Karakter ditunjukkan, satu poin diraih. Bangga dengan para pemain dan dukungan luar biasa dari suporter tandang,” tulis Diks dalam akun Instagram-nya @kevindiks2, Senin (22/9/2025).
Follow WhatsApp Channel Okezone untuk update berita terbaru setiap hari
Follow
Topik Artikel :
Berita Terkait
Telusuri berita bola lainnya",ok_trafilatura,,False
"Sebar Bansos Minyak Goreng, Pemerintah Tambah Anggaran",Tidak Diketahui,https://www.liputan6.com/bisnis/read/6165431/sebar-bansos-minyak-goreng-pemerintah-tambah-anggaran,liputan6,2025-09-22 14:15:43+07:00,www.liputan6.com,"Liputan6.com, Jakarta Pemerintah tengah mempersiapkan anggaran untuk daftar bantuan sosial (bansos) tambahan pada akhir 2025 berupa minyak goreng sebanyak 2 liter.
Sebelumnya Pemerintah akan menyalurkan bantuan pangan beras dua bulan Oktober dan November 2025 dalam bentuk beras 10 kilo untuk 18,27 KPM (Keluarga Penerima Manfaat).
Menkeu Purbaya Siap Tambah Bansos Jika ada Anggaran Nganggur
Menkeu Purbaya Siap Tambah Bansos Jika ada Anggaran Nganggur
Purbaya Tantang DPR Soal Bansos Minyak Goreng: Kenapa Enggak 5 Liter Sekalian?
Purbaya Tantang DPR Soal Bansos Minyak Goreng: Kenapa Enggak 5 Liter Sekalian?
Waspada Penipuan Lewat Hoaks Berkedok Cek Status Penerima Bantuan, Berikut Daftarnya
Waspada Penipuan Lewat Hoaks Berkedok Cek Status Penerima Bantuan, Berikut Daftarnya
“Sudah dipersiapkan sama Pak Menteri Keuangannya,” kata Menteri Koordinator Bidang Perekonomian Airlangga Hartarto, dalam konferensi pers, di Kantor Kemenko Perekonomian, Jakarta, Senin (22/9/2025).
Dalam kesempatan yang sama, Menteri Keuangan Purbaya Yudhi Sadewa mengatakan bahwa pihaknya sedang mempersiapkan anggaran tambahan untuk bansos minyak goreng. Namun, Menkeu tidak menyebutkan secara pasti nominal anggaran yang akan digunakan.
“Sudah disiapkan jadi 10 kg tambah 2 liter minyak sudah dipersiapkan anggarannya cukup,” ujar Menkeu Purbaya.
Lebih lanjut, Airlangga menambahkan bahwa bantuan tambahan minyak goreng masing-masing KPM akan menerima 4 liter minyak goreng, untuk bantuan periode Oktober hingga Desember 2025.
“Jadi, 2 liter  kali 18 juta itu dikali 2 liter 2 paket jadi 4 liter,” ujar Airlangga.
Kepala Badan Pangan Nasional/National Food Agency (NFA) Arief Prasetyo Adi memastikan pemerintah bersiap untuk program prorakyat tersebut dan ditargetkan pada Oktober akan mulai dijalankan. Ia pun memastikan paket bantuan pangan berupa beras dan minyak goreng berkualitas baik.
""Seperti diketahui, untuk bantuan pangan beras dua bulan Oktober dan November itu memang sudah disetujui, dalam bentuk beras 10 kilo untuk 18,27 KPM (Keluarga Penerima Manfaat). Kemarin dalam dinamikanya ada usulan dari Ketua Banggar DPR, untuk tambahan 2 liter minyak goreng. Kita siapkan yang baik buat masyarakat kita,"" jelas Arief dikutip di Jakarta pada Senin (22/9/2025).
""Terkait mutu, pastinya harus baik. Bantuan pangan itu tidak boleh jelek. Tentunya nanti untuk beras dan minyak goreng juga harus sama-sama baik. Dalam hal ini Badan Pangan Nasional akan menyampaikan dalam Rakortas, kemudian diputuskan bersama-sama, terkait berapa anggarannya, berapa jumlah penerima, dan product specific-nya. Jadi perlu melibatkan banyak kementerian lembaga,"" tambahnya.
Dikutip dari laman Badan Pangan Nasional/National Food Agency (NFA), harga beras medium dan minyak goreng MinyaKita dalam pantauan Panel Harga Pangan NFA masih cukup dinamis.
Per 21 September, rerata harga beras medium secara nasional telah menurun dibandingkan seminggu sebelumnya. Zona 1 dari Rp 13.447 per kg menjadi Rp 13.420 per kg. Zona 2 dari Rp 14.051 per kg ke Rp 14.029 per kg dan Zona 3 dari Rp 16.147 per kg ke Rp 15.808 per kg.
Sementara rerata harga MinyaKita per 21 September masih berada di level Rp 17.463 per liter atau 11,23 persen lebih tinggi daripada Harga Eceran Tertinggi (HET) yang Rp 15.700 per liter.
Kendati begitu, apabila dibandingkan pada sebulan sebelumnya, rerata harga MinyaKita mengalami penurunan 0,93 persen karena saat itu berada di harga Rp 17.529 per liter.",ok_site_specific,,False
