judul_berita,penulis_berita,url_berita,media_online,tanggal_berita_dt,source_domain,artikel_berita,status,error,is_empty
"Serap Investasi Rp 6,5 Triliun, KEK Sei Mangkei Kini Jadi Pusat Hilirisasi Sawit",Tidak Diketahui,https://www.liputan6.com/bisnis/read/6164782/serap-investasi-rp-65-triliun-kek-sei-mangkei-kini-jadi-pusat-hilirisasi-sawit,liputan6,2025-09-21 12:30:46+07:00,www.liputan6.com,"Liputan6.com, Jakarta Pengembangan Kawasan Ekonomi Khusus (KEK) terus didorong Pemerintah untuk mempercepat hilirisasi industri, meningkatkan ekspor, dan membuka pusat pertumbuhan yang memperkuat daya saing nasional sekaligus menyediakan lapangan kerja bagi masyarakat.
Dalam kerangka tersebut, Pemerintah melakukan diskusi sekaligus kunjungan lapangan ke KEK Sei Mangkei dan Pelabuhan Kuala Tanjung di Sumatera Utara untuk memastikan integrasi kawasan industri dengan pelabuhan internasional berjalan optimal.
Pemasok Lithium Iron Dunia Tanam Investasi Rp 1,5 Triliun di KEK Industropolis Batang
Pemasok Lithium Iron Dunia Tanam Investasi Rp 1,5 Triliun di KEK Industropolis Batang
Investasi KEK Tembus Rp 294 Triliun, Terbanyak ke Wilayah Ini
Investasi KEK Tembus Rp 294 Triliun, Terbanyak ke Wilayah Ini
The Meru Sanur & Bali Beach Hotel yang Dikelola InJourney Hospitality Masuk 100 Hotel Terbaik Dunia dan 30 Resor & Hotel Terbaik Bali
The Meru Sanur & Bali Beach Hotel yang Dikelola InJourney Hospitality Masuk 100 Hotel Terbaik Dunia dan 30 Resor & Hotel Terbaik Bali
“Kami sangat berharap perkembangan KEK dan investasi di wilayah Sumatera Utara ini bisa mendukung perekonomian daerah, yang pada akhirnya bisa mendukung target pertumbuhan ekonomi nasional,” tutur Staf Ahli Bidang Pembangunan Daerah Kemenko Perekonomian Haryo Limanseto, Sabtu (20/09).
Menyerap investasi sebesar Rp6,5 triliun, KEK Sei Mangkei sendiri telah berkembang sebagai pusat hilirisasi sawit dengan dan mampu mencatatkan ekspor senilai Rp2,7 triliun hingga 2024.
Perluasan kawasan yang dilakukan melalui proyek KernelMax diproyeksikan akan mendatangkan tambahan investasi sekitar USD20 juta dan telah menyerap sekitar 9.600 tenaga kerja. Berbagai capaian yang telah diraih menjadi bukti bahwa KEK Sei Mangkei tidak hanya mampu mendukung peningkatan ekspor dan investasi, tetapi juga memberi manfaat langsung bagi masyarakat melalui penciptaan lapangan kerja dan peningkatan keterampilan.
Dalam diskusi tersebut, juga ditekankan pentingnya dukungan infrastruktur penunjang agar KEK Sei Mangkei dapat berkembang lebih optimal. Ketersediaan energi, perumahan, serta fasilitas akomodasi dan hunian yang layak bagi pekerja menjadi faktor penting dalam menjaga kelancaran aktivitas industri.
Lebih lanjut, Pelabuhan Kuala Tanjung diproyeksikan menjadi simpul logistik internasional yang terintegrasi dengan KEK Sei Mangkei. Integrasi ini akan memperlancar arus barang, menekan biaya logistik, dan membuka akses yang lebih luas bagi produk-produk hilir Indonesia. Dengan penguatan infrastruktur pelabuhan, Sumatera Utara diharapkan tumbuh sebagai pintu gerbang perdagangan strategis di kawasan barat Indonesia.
Selain itu, koordinasi lintas pemangku kepentingan menjadi kunci untuk mewujudkan keberhasilan pengembangan kawasan. Komitmen penguatan sinergi antara Pemerintah Pusat bersama Pemerintah Daerah serta dunia usaha sangat penting, baik melalui penyediaan infrastruktur, insentif fiskal, maupun kepastian regulasi.
Melalui diskusi dan kunjungan tersebut, Pemerintah berharap pengembangan KEK dapat terus diperkuat untuk menjadi  salah satu pilar penting dalam transformasi ekonomi nasional menuju Indonesia Emas 2045.
Dengan capaian realisasi  investasi KEK yang telah mencapai Rp294,4 triliun secara akumulatif hingga semester I 2025 serta penyerapan tenaga kerja sebanyak 187 ribu orang, keberadaan KEK Sei Mangkei dan Pelabuhan Kuala Tanjung diharapkan dapat semakin memperkuat kontribusi Indonesia dalam rantai pasok global, sekaligus menghadirkan pertumbuhan ekonomi yang inklusif, merata, dan berkelanjutan.
Turut hadir pada kesempatan tersebut di antaranya yakni Kepala Administratror KEK Sei Mangkei Elfi Haris, Kabid Fasilitas Kanwil DJBC Sumut Rafik, Kepala KPPBC Kuala Tanjung Agus Sujendro, Secretary Corporate PT KINRA Miswarinda, serta sejumlah perwakilan stakeholders lainnya.",ok_site_specific,,False
Ketua DPR Harap Tim Reformasi Polri Tingkatkan Citra Positif di Mata Publik,Tidak Diketahui,https://news.okezone.com/read/2025/09/22/337/3171670/ketua-dpr-harap-tim-reformasi-polri-tingkatkan-citra-positif-di-mata-publik,okezone,2025-09-22 15:38:00+07:00,news.okezone.com,"Ketua DPR RI Puan Maharani (foto: Okezone)
JAKARTA – Ketua DPR RI Puan Maharani menyoroti pembentukan Tim Transformasi Reformasi Polri. Ia berharap tim tersebut dapat membenahi institusi Polri menjadi lebih baik.
“Ya tentu saja kami berharap tim transformasi ini betul-betul bisa mentransformasi Polri secara baik, dari dalam maupun ke luar,” kata Puan saat ditemui di Kompleks Parlemen, Senayan, Jakarta Pusat, Senin (22/9/2025).
Menurut Puan, jika pembenahan dapat dilakukan dengan baik, maka citra polisi di mata publik juga akan meningkat.
“Bisa meningkatkan citra positif Polri terhadap kinerjanya di hadapan masyarakat,” pungkasnya.
Sebelumnya, Kapolri Jenderal Listyo Sigit Prabowo membentuk Tim Transformasi Reformasi Polri melalui Surat Perintah Kapolri Nomor Sprin/2749/X/TUK.2.1./2025.
Follow WhatsApp Channel Okezone untuk update berita terbaru setiap hari
Follow
Topik Artikel :
Berita Terkait
Telusuri berita news lainnya
Terpopuler",ok_trafilatura,,False
Kondisi Jasad Bocah 8 Tahun Tewas di Kos Jakut: Tanpa Busana-Membusuk,Tidak Diketahui,https://news.detik.com/berita/d-8124435/kondisi-jasad-bocah-8-tahun-tewas-di-kos-jakut-tanpa-busana-membusuk,detik,2055-09-23 00:00:00+07:00,news.detik.com,"Polisi mengungkap kondisi bocah perempuan berinisial AR (8) yang ditemukan dalam kondisi bersimbah darah dan membusuk di sebuah rumah kos di Penjaringan, Jakarta Utara ( Jakut ). Korban ditemukan dalam kondisi tak berbusana.
""Betul. Tergeletak, tanpa busana, dan menengadah ke atas,"" kata Kapolsek Penjaringan Kompol Agus Ady Wijaya kepada wartawan, Senin (22/9/2025).
Korban juga ditemukan dalam kondisi membusuk. Dari hasil penyelidikan sementara, diduga korban sudah meninggal dunia selama lima hari lamanya.
SCROLL TO CONTINUE WITH CONTENT
""Iya betul sudah membusuk, berdasarkan analisa awal dari tim ident yang olah TKP, diperkirakan sudah 5 hari meninggalnya,"" tuturnya.
Meski demikian, pihak kepolisian masih mendalami penyebab pasti kematian korban. Korban sudah dievakuasi ke RS Polri untuk dilakukan proses autopsi.
""Mayat sudah dibawa ke RS Keramat Jati untuk dilakukan autopsi untuk mengetahui penyebab kematiannya karena kondisi mayat sudah membusuk sehingga permukaan luar tubuh jenazah sulit dianalisa kasat mata. Kami juga sedang menunggu hasil autopsi,"" tuturnya.
Selain itu, lima orang, termasuk tetangga kos, sudah dimintai keterangan. Polisi masih melakukan serangkaian penyelidikan mendoakan.
""Berkoordinasi dengan laboratorium forensik, digital forensic , dan psikologi forensik untuk mendukung upaya penyelidikan dan penyidikan. Atas petunjuk bapak Kapolres, dibentuk tim gabungan polres dan polsek untuk mengungkap tuntas dan terang benderang peristiwa ini melalui proses penyelidikan dan penyidikan,"" jelasnya.
Awal Mula Penemuan Korban
Pihak kepolisian mendapatkan informasi pada Minggu (21/9), pukul 00.00 WIB. Korban ditemukan oleh ayahnya, S (42).
Kapolsek Penjaringan Kompol Agus Ady Wijaya mengatakan kedua orang tua korban sudah berpisah sejak 4 bulan lalu. Korban tinggal di kontrakan tersebut bersama ibunya berinisial MKR (35).
""Kedua orang tuanya sudah berpisah sejak 4 bulan lalu sehingga di kosan tersebut hanya tinggal ibu dan anak,"" kata Ady kepada wartawan.
Sang ayah saat itu mengaku rindu dengan anaknya dan berusaha mengunjunginya, tapi tidak ada respons. Ayah korban datang ke lokasi dan mendapati anaknya sudah tewas.
""Awalnya Bapaknya kangen pengin ketemu anaknya, dihubungi tapi tidak ada respons. Akhirnya datang ke lokasi dan bersama warga mengetahui ada mayat, laporan ke Kamtib dan Bhabinkamtibmas,"" jelasnya.
Ady menambahkan, ibu korban, MKR tidak ada di lokasi kejadian. Saat ini pihak kepolisian masih mencari keberadaan sang ibu.
""Saat di TKP ada bapaknya, tapi ibunya sudah tidak ada di lokasi TKP. Kami masih telusuri bukti CCTV sekitaran lingkungan untuk dilihat persesuaiannya dengan keterangan saksi,"" jelasnya.
Lihat juga Video 'Bocah Depok Nyangkut di Mesin Cuci, Damkar Turun Tangan Evakuasi':
[Gambas:Video 20detik]",ok_site_specific,,False
"Sosok Ketua Tim Reformasi Polri, Jenderal Bergelar Profesor Peraih 3 Penghargaan Internasi...",Tidak Diketahui,https://www.liputan6.com/news/read/6165295/sosok-ketua-tim-reformasi-polri-jenderal-bergelar-profesor-peraih-3-penghargaan-internasional,liputan6,2025-09-22 10:58:32+07:00,www.liputan6.com,"Liputan6.com, Jakarta- Kapolri Jenderal Pol. Listyo Sigit Prabowo membentuk Tim Transformasi Reformasi Polri . Komjen Pol. Chryshnanda Dwilaksana ditunjuk sebagai ketua.
Karopenmas Divisi Humas Polri, Brigjen Trunoyudo Wisnu Andiko mengatakan, tim internal itu terdiri dari 52 Pati. Dalam struktur, Kapolri Jenderal Listyo Sigit Prabowo menjabat sebagai pelindung dan Wakapolri Komjen Dedi Prasetyo sebagai penasihat.
Tim Reformasi Polri Disebut Momentum untuk Tingkatkan Akuntabilitas dan Profesionalitas Kepolisian
Tim Reformasi Polri Disebut Momentum untuk Tingkatkan Akuntabilitas dan Profesionalitas Kepolisian
Puan Sambut Baik Tim Reformasi Polri: Harus Tingkatkan Citra dan Kinerja
Puan Sambut Baik Tim Reformasi Polri: Harus Tingkatkan Citra dan Kinerja
Blak-blakan Kapolri Ungkap Alasan Bentuk Tim Reformasi Polri
Blak-blakan Kapolri Ungkap Alasan Bentuk Tim Reformasi Polri
Disusul empat jajaran pengarah, dengan Komjen Wahyu Hadiningrat sebagai Pengarah Transformasi Bidang Organisasi, Komjen Mohammad Fadil Imrah sebagai Pengarah Transformasi Bidang Operasional, Komjen Akhmad Wiyagus sebagai Pengarah Transformasi Bidang Pelayanan, dan Komjen Wahyu Widada sebagai Pengarah Transformasi Bidang Pengawasan. Menjabat sebagai wakil ketua tim, yaitu Irjen Herry Rudolf Nahak dan Brigjen Susilo Teguh Raharjo.
“Kapolri Jenderal Pol. Listyo Sigit Prabowo telah memerintahkan kepada staf dan jajarannya sebagai langkah responsibilitas dan akuntabilitas,” kata Trunoyudo, Senin (22/9/2025).
Pembentukan tim tersebut tertuang melalui Surat Perintah (Sprin) bernomor Sprin/2749/IX/TUK.2.1/2025 yang ditandatangani oleh Kapolri pada 17 September 2025.
Trunoyudo mengatakan surat perintah ini merupakan tindak lanjut Polri dalam mengelola transformasi institusi dengan bekerja sama dengan pemerintah dan stakeholders (pemangku kepentingan) terkait melalui pendekatan sistematis.
“Transformasi institusi guna mencapai proses dan tujuan akselerasi transformasi Polri sesuai dengan harapan masyarakat,” ujarnya.
Chryshnanda Dwilaksana saat ini juga menjabat Kepala Lembaga Pendidikan dan Pelatihan (Kalemdiklat) Polri. Dia merupakan lulusan Akademi Kepolisian (Akpol) tahun 1989.
Lahir di Magelang pada 3 Desember 1967, Chryshnanda dikenal luas sebagai perwira yang tak hanya matang secara pengalaman operasional, tetapi juga kaya secara intelektual.
Dia menempuh pendidikan tinggi dan pelatihan kepolisian lanjutan, seperti PTIK, Sespim, Sespimti, hingga Lemhannas, serta aktif sebagai akademisi, bahkan telah menyandang gelar profesor di bidang ilmu kepolisian di lingkungan Lemdiklat Polri.
Selama kariernya, dia menempati berbagai jabatan strategis, seperti Kasatlantas di sejumlah daerah, Direktur Lalu Lintas di Polda Riau dan Polda Metro Jaya, hingga akhirnya dipercaya memimpin Korlantas Polri dan kemudian menjabat Kalemdiklat Polri sejak 2024.
Sepanjang perjalanan kariernya, Komjen Chryshnanda Dwilaksana telah menerima berbagai penghargaan bergengsi, baik nasional hingga internasional. Di antaranya Bintang Bhayangkara Pratama dan Bintang Bhayangkara Nararya, dua tanda kehormatan tertinggi di lingkungan Polri yang diberikan atas jasa luar biasa terhadap institusi.
Tak hanya itu, Chryshnanda juga menerima deretan Satyalancana, mulai dari Satyalancana Pengabdian 8, 16, 24 hingga 32 tahun, yang menandai dedikasi panjangnya dalam dinas kepolisian.
Dia juga dianugerahi Satyalancana Ksatria Bhayangkara, Jana Utama, Bhakti Nusa, Karya Bhakti, Dwidya Sistha, Kebhaktian Sosial, dan Santi Dharma, penghargaan yang menunjukkan kontribusinya di berbagai bidang, mulai dari pendidikan, sosial, hingga pengabdian dalam tugas luar negeri.
Di tingkat internasional, namanya harum lewat kiprah sebagai bagian dari misi perdamaian PBB, yang dibuktikan dengan dianugerahkannya United Nations Protection Force (UNPROFOR) Medal dan United Nations Mission in Bosnia and Herzegovina (UNMIBH) Medal.
Penghormatan tertinggi dari luar negeri juga datang dari Timor Leste, yang menganugerahkan Medal of Merit pada 2025, sebagai bentuk apresiasi atas kontribusinya dalam menjaga stabilitas dan kerja sama lintas negara.",ok_site_specific,,False
Sosok FT Wanita Cantik Bersama Anggota DPRD Wahyudin Moridu yang Viral ‘Ingin Rampok Uang Negara’,Tidak Diketahui,https://news.okezone.com/read/2025/09/22/337/3171622/sosok-ft-wanita-cantik-bersama-anggota-dprd-wahyudin-moridu-yang-viral-lsquo-ingin-rampok-uang-negara-rsquo,okezone,2025-09-22 12:56:00+07:00,news.okezone.com,"Sosok FT Wanita Cantik Bersama Anggota DPRD Wahyudin Moridu yang Viral ‘Ingin Rampok Uang Negara’
JAKARTA – PDI Perjuangan telah memecat Wahyudin Moridu dari jabatannya sebagai anggota DPRD Provinsi Gorontalo. Keputusan ini diambil menyusul video viral Wahyudin yang menyebut ingin merampok uang Negara.
Dalam video yang beredar, Wahyudin bersama seorang wanita yang diketahui teman dekatnya bernama Fadilah alias FT berada dalam mobil SUV. Wahyudin tertawa bersama FT sembari melontarkan kalimat yang menyebut akan menghabiskan uang negara hingga membuat negara miskin.
“Kita rampok saja uang negara ini kan, kita habiskan saja biar negara ini semakin miskin,” ujarnya dalam video yang beredar di media sosial, dikutip Senin (22/9/2025).
Sementara itu, Badan Kehormatan (BK) DPRD Provinsi Gorontalo telah memanggil Wahyudin untuk dimintai keterangan terkait video viral yang beredar.
Wakil Ketua BK, Umar Karim, mengatakan bahwa sosok perempuan yang bersama Wahyudin telah disebutkan secara langsung.
Follow WhatsApp Channel Okezone untuk update berita terbaru setiap hari
Follow
Topik Artikel :
Berita Terkait
Telusuri berita news lainnya
Terpopuler",ok_trafilatura,,False
"Undang Prabowo, Serikat Buruh Gelar Apel Besar-besaran di Bekasi Bulan Depan",Tidak Diketahui,https://news.detik.com/berita/d-8124498/undang-prabowo-serikat-buruh-gelar-apel-besar-besaran-di-bekasi-bulan-depan,detik,2037-09-23 00:00:00+07:00,news.detik.com,"Serikat buruh akan menggelar apel besar di wilayah Bekasi bulan depan. Mereka akan mengundang Presiden Prabowo Subianto.
Hal ini disampaikan oleh Presiden Konfederasi Serikat Pekerja Seluruh Indonesia (KSPSI) Andi Gani setelah bertemu dengan Ketua DPR RI Puan Maharani. Ia menyebutkan rencana apel besar itu akan digelar pada 8 Oktober mendatang.
""Kami menyampaikan kepada DPR kami akan menggelar apel besar kebangsaan buruh yang akan dilakukan di Bekasi nanti,"" kata Andi Gani kepada wartawan di lokasi, Senin (22/9/2025).
SCROLL TO CONTINUE WITH CONTENT
Andi Gani mengatakan pihaknya akan mengundang Prabowo dalam kegiatan ini. Hal itu sekaligus menegaskan dukungan buruh kepada pemerintah.
""Ya, kami mengundang Presiden Republik Indonesia langsung. Kami mengundang Pak Prabowo Subianto, menegaskan dukungan kami kepada pemerintahan yang sah bahwa bangsa ini harus aman dan nyaman,"" sambung dia.
Andi membeberkan situasi saat ini memang sedang tidak menentu. Ia menyinggung kerusuhan pecah di sejumlah negara. Ia berharap semua pihak bekerja sama menjaga kondusivitas Indonesia.
""Karena sangat mengerikan hari ini. Dari kemarin Filipina bergolak. Nepal, Australia, sekarang Filipina. Yang saya dengar Thailand sedang bersiap-siap. Kalau kita tidak jaga bersama, akan sangat bahaya kondisi Indonesia. Ketika kita rusuh atau ricuh, pasti investasi akan lari dari Indonesia. Dan itu yang dirugikan adalah rakyat dan juga buruh Indonesia,"" ungkapnya.
Andi Gani mendukung sepenuhnya demokrasi di Indonesia. Namun tidak dengan kericuhan seperti yang terjadi beberapa waktu lalu.
""Demokrasi adalah hal yang sangat kita dukung karena kami bagian dari demokrasi itu sendiri. Tetapi soal perusakan, kualitas publik, pembakaran-pembakaran yang mengakibatkan korban jiwa, itu kami akan sesalkan,"" imbuh dia.
Simak Video 'Panglima TNI Minta Maaf Rangkaian HUT TNI ke-80 di Monas Bikin Macet':
[Gambas:Video 20detik]",ok_site_specific,,False
Purbaya Ungkap Kepercayaan Investor Pulih Cepat Pasca Demo 17+8News1 jam yang lalu,Tidak Diketahui,https://www.cnbcindonesia.com/news/20250922141255-4-669117/purbaya-ungkap-kepercayaan-investor-pulih-cepat-pasca-demo-17-8,cnbc,2025-09-22 00:00:00+07:00,www.cnbcindonesia.com,"Purbaya Ungkap Kepercayaan Investor Pulih Cepat Pasca Demo 17+8
Jakarta, CNBC Indonesia - Menteri Keuangan Purbaya Yudhi Sadewa mengungkapkan jajarannya, Kementerian Keuangan, yakin aliran modal asing ke Tanah Air akan tetap masuk ke depan. Ini akan menandakan prospek ekonomi Indonesia cukup baik.
""Ke depan akan semakin baik karena modal asing ke pasar saham sudah masuk dan harusnya prospek ekonomi kita akan terus membaik,"" kata Purbaya dalam konferensi Pers APBN KITA, Senin (22/9/2025).
Purbaya menuturkan risiko spread nilai tukar rupiah terus turun, meski belum signifikan. Namun, risiko spread nilai tukar ini turun dari sebelumnya meningkat tajam pada masa demonstrasi 17+8 di Indonesia. Adapun, rupiah berada pada level Rp 16.428 per dolar AS pada 19 September 2025. Posisi rupiah ini masih melemah 3% secara year to date (ytd).
""Ini kan sempat naik turun lagi, cepat sekali kepercayaan investor recover,"" ujarnya.
Selain itu, spread atau gap imbal hasil SBN dan US Treasury terjaga di level 79 basis poin. Purbaya yakin spread atau gapnya akan trus turun melihat kondisi ekonomi Indonesia yang cukup stabil.
(haa/haa)
[Gambas:Video CNBC]
Next Article Video: Berjalan 3 Bulan, Laporan Kemenkeu Sebut MBG Telan Rp 3 T",ok_trafilatura,,False
"Klarifikasi Kepala BKN soal PPPK: Bukan Merendahkan, Hanya Penjelasan UU",Tidak Diketahui,https://www.liputan6.com/bisnis/read/6164848/klarifikasi-kepala-bkn-soal-pppk-bukan-merendahkan-hanya-penjelasan-uu,liputan6,2025-09-21 15:00:06+07:00,www.liputan6.com,"Liputan6.com, Jakarta Badan Kepegawaian Negara (BKN) menerima perwakilan Asosiasi Dosen ASN PPPK Indonesia (ADAPI) di Jakarta pada Rabu, 17 September 2025. Pertemuan ini menjadi ajang klarifikasi dan tabayun terkait pernyataan Kepala BKN, Zudan Arif Fakrulloh, yang sempat menuai sorotan publik.
Dalam kesempatan tersebut, Ketua BKN Zudan menegaskan bahwa penjelasan yang ia sampaikan saat seminar di Universitas Lancang Kuning pada 14 Agustus 2025 sepenuhnya mengacu pada Undang-Undang Nomor 5 Tahun 2014 tentang ASN, Undang-Undang Nomor 20 Tahun 2023, serta peraturan pelaksanaannya. Materi yang dipresentasikan murni bersifat akademis dan normatif.
Mengenal SIASN BKN, Layanan Pendukung Manajemen ASN
Mengenal SIASN BKN, Layanan Pendukung Manajemen ASN
Panduan Lengkap Pendaftaran CPNS via SSCASN: Persiapan Rekrutmen ASN 2025/2026
Panduan Lengkap Pendaftaran CPNS via SSCASN: Persiapan Rekrutmen ASN 2025/2026
Panduan Lengkap Membuat Akun SSCASN BKN: Gerbang Utama Seleksi CASN
Panduan Lengkap Membuat Akun SSCASN BKN: Gerbang Utama Seleksi CASN
""Saya sampaikan semuanya bahwa yang saya jelaskan waktu di Universitas Lancang Kuning tanggal 14 Agustus 2025 dalam waktu seminar di sana yang kemudian dibuatkan videonya di Universitas Lancang Kuning itu sepenuhnya adalah materi dalam Undang-Undang ASN di Undang-Undang Nomor 5 Tahun 2014 dan Undang-Undang Nomor 20 Tahun 2023 dan peraturan pelaksanaannya sepenuhnya materi itu,"" jelas Zudan dalam keterangannya, di Jakarta, ditulis Minggu (21/9/2025).
Zudan menegaskan, bahwa dirinya tidak ada niat sedikitpun untuk merendahkan atau meremehkan status PPPK. Justru dirinya ingin menyampaikan bahwa desain kebijakan kepegawaian di Indonesia memang terdiri dari dua skema, yaitu PNS dan PPPK.
""Saya jelaskan tidak ada yang bersifat merendahkan, meremehkan PPPK bahkan saya ingin menyadarkan bahwa kondisi kebijakan desain kepegawaian kita seperti itu ada dua PNS dan PPPK,"" ujarnya.
Ia menambahkan, PNS bekerja hingga batas usia pensiun, sementara PPPK bekerja dengan sistem perjanjian kerja tertentu minimal satu tahun yang dapat diperpanjang sesuai kebutuhan. Menurutnya, hal ini adalah konsekuensi dari regulasi, bukan pendapat pribadi.
"" PNS berbatas pada usia pensiun selesainya, PPPK dengan perjanjian kerja dengan masa kerja tertentu paling singkat 1 tahun dan dapat diperpanjang apabila perjanjian kerjanya sudah habis,"" jelas Zudan.
Dalam kesempatan yang sama, Ketua Umum ADAPI Moh. Nor Afandi yang hadir dalam pertemuan tersebut menyampaikan apresiasi atas keterbukaan Kepala BKN. Menurutnya, pertemuan ini penting untuk meluruskan persepsi yang berkembang di masyarakat terkait pernyataan Zudan yang sempat viral.
""Kami selaku Ketua Umum Adapi, menyampaikan terimakasih kepada pak Zudan yang telah menerima kami, sehingga kami bisa bersilaturahmi secara langsung di kantor BKN dan tadi kami sudah berdiskusi banyak bahwa apa yang memang terjadi itu semata-mata penjelasan dari Prof Zudan dan juga kami cukup bisa memahami karena memang itu adalah pesan dari pada undang-undang,"" ujar Nor Afandi.
Nor Afandi menegaskan, kesalahpahaman yang beredar di luar hanya karena potongan video dan narasi yang tidak utuh. Padahal, penjelasan Kepala BKN sesuai dengan koridor hukum yang berlaku.
""Yang kemudian apa yang terjadi dan viral di luar sana itu hanya sebatas kesalahpahaman yang kemudian saat inilah kami mengklarifikasi atau paling tidak kami tabayun untuk kemudian apa yang disampaikan Prof Zudan itu adalah bahasa dari para undang-undang,"" ujarnya.
Dalam dialog tersebut, ADAPI juga menegaskan komitmennya untuk ikut berperan aktif dalam mengawal kebijakan dan sistem kepegawaian nasional. Organisasi ini melihat pentingnya kerja sama dengan BKN untuk mencari solusi terbaik bagi tenaga ASN, khususnya P3K.
Ketua ADAPI menyebut, perjuangan P3K masih panjang, terutama dalam hal kepastian karier dan perlindungan kerja. Oleh karena itu, sinergi dengan BKN diharapkan dapat membuka ruang perbaikan regulasi di masa depan.
""Kami selaku Ketua Umum Adapi juga berwajiban untuk ikut andil bagaimana peran dan upaya untuk mekanisme dan sistem pegawaian di Indonesia ini juga kami juga kawan dan bantu terutama teman-teman P3K yang ini juga masih butuh perjuangan banyak yang pada akhirnya ada beberapa solusi yang disampaikan oleh beliau dan itu menjadi hal yang pada akhirnya sebagai jelas keluar nanti,"" pungkasnya.",ok_site_specific,,False
Pemalsu Cukai Rokok Siap-Siap Dikejar Menkeu Purbaya,Tidak Diketahui,https://www.liputan6.com/bisnis/read/6164884/pemalsu-cukai-rokok-siap-siap-dikejar-menkeu-purbaya,liputan6,2025-09-21 17:00:16+07:00,www.liputan6.com,"Liputan6.com, Jakarta Menteri Keuangan (Menkeu) Purbaya Yudhi Sadewa berkomitmen akan memberantas peredaran rokok ilegal dan pemalsuan pita cukai.  Menurutnya, keberadaan rokok palsu merugikan negara sekaligus mengancam keberlangsungan industri resmi yang taat membayar pajak.
“Enggk fair kalau kita tarik ratusan triliun pajak dari rokok . Sementara mereka enggak dilindungi. Marketnya enggak dilindungi,” kata Purbaya saat ditemui di kantornya Kementerian Keuangan, ditulis Minggu (21/9/2025).
Cukai Rokok Tinggi Bikin Negara Rugi Rp 25 Triliun per Tahun
Cukai Rokok Tinggi Bikin Negara Rugi Rp 25 Triliun per Tahun
DPR Minta Pemerintah Fokus Berantas Rokok Ilegal, Yakin Penerimaan Negara Bakal Naik
DPR Minta Pemerintah Fokus Berantas Rokok Ilegal, Yakin Penerimaan Negara Bakal Naik
Purbaya Tak Kasih Ampun Oknum Bea Cukai Beking Rokok Ilegal
Purbaya Tak Kasih Ampun Oknum Bea Cukai Beking Rokok Ilegal
Purbaya menilai, jika industri resmi terus ditekan dengan tarif cukai tinggi sementara rokok ilegal bebas beredar, maka dampaknya sama saja seperti membunuh industri dalam negeri.
“Kita membunuh industri kita, masuk palsu dari China atau dari luar negeri ya,” ujarnya.
Ia menekankan, pemerintah harus hadir melindungi pelaku usaha yang patuh aturan. Karena itu, ia menginstruksikan agar pemantauan terhadap penjualan rokok online diperketat. Purbaya ingin agar praktik jual-beli rokok palsu dapat dilacak dan ditindak tegas.
Menkeu menjelaskan, dirinya telah memerintahkan aparat terkait untuk mulai memonitor peredaran rokok palsu di platform daring. Baik penjual maupun pembeli akan menjadi target pemantauan agar praktik perdagangan ilegal tersebut bisa segera ditekan.
“Saya kan sudah perintahkan untuk mulai memonitor siapa aja yang jual, beli online untuk barang-barang yang palsu. Jadi, hati-hati mereka yang palsu-palsu. Bukannya normal ya, yang palsu. Kita akan mulai kejar satu-satu. Kalau yang normal biar, yang palsu aja,” ujarnya.
Purbaya juga menegaskan bahwa perlindungan pasar domestik merupakan bagian penting dari kebijakan fiskal. Tanpa perlindungan tersebut, industri rokok resmi hanya akan menjadi korban dari persaingan tidak sehat dengan produk ilegal.
Purbaya juga menyoroti tarif rata-rata cukai rokok yang kini sudah mencapai 57 persen. Angka tersebut dinilai sangat tinggi dan menimbulkan pertanyaan mengenai efektivitasnya.
""Saya tanya kan cukai rokok gimana? Sekarang berapa rata-rata? 57 persen. Wah tinggi amat,"" ujarnya.
Menurut Purbaya, kebijakan cukai memang ditujukan untuk menekan konsumsi, namun dampaknya tidak berhenti di situ. Ia menjelaskan, meski cukai tinggi berhasil mengendalikan permintaan, konsekuensi yang timbul justru menekan industri serta tenaga kerja.",ok_site_specific,,False
