judul_berita,penulis_berita,url_berita,media_online,tanggal_berita_dt,source_domain,artikel_berita,status,error,is_empty
Ekonomi Kreatif Jadi Mesin Baru Pertumbuhan Ekonomi,Tidak Diketahui,https://www.liputan6.com/bisnis/read/6164809/ekonomi-kreatif-jadi-mesin-baru-pertumbuhan-ekonomi,liputan6,2025-09-21 13:30:46+07:00,www.liputan6.com,"Liputan6.com, Jakarta Kementerian Dalam Negeri (Kemendagri) Republik Indonesia (RI) melalui Direktorat Jenderal (Ditjen) Bina Keuangan Daerah (Keuda) bersama Otoritas Jasa Keuangan (OJK) dan Tim Percepatan Akses Keuangan Daerah (TPAKD) bersinergi mendorong ekonomi daerah.
Hal ini disampaikan Pelaksana harian (Plh) Direktur Jenderal (Dirjen) Bina Keuangan Daerah (Keuda) Kemendagri, Horas Maurits Panjaitan dalam acara Pembekalan Calon Kepala Kantor OJK (PCKO) Angkatan 2 Tahun 2025 dengan bertajuk Peran Kantor OJK Daerah Dalam Mendukung Pengembangan Daerah melalui Program TPAKD.
Sinergi Ekraf–Peruri: Dorong Lapangan Kerja dan Digitalisasi Industri Kreatif Indonesia
Sinergi Ekraf–Peruri: Dorong Lapangan Kerja dan Digitalisasi Industri Kreatif Indonesia
Pemerintah Dorong AI Jadi Mesin Baru Ekonomi Kreatif Indonesia
Pemerintah Dorong AI Jadi Mesin Baru Ekonomi Kreatif Indonesia
Indonesia Design Week 2025 Resmi Dibuka, Menekraf Optimistis Bantu Dongkrak Ekonomi Indonesia
Indonesia Design Week 2025 Resmi Dibuka, Menekraf Optimistis Bantu Dongkrak Ekonomi Indonesia
Maurits mengatakan Kemendagri memiliki peran strategis dalam melakukan pembinaan dan pengawasan umum penyelenggaraan. Hal ini sebagaimana amanat Undang-Undang (UU) Nomor 23 Tahun 2014 tentang Pemerintahan Daerah.
“Selain itu berdasarkan Undang-Undang Nomor 23 Tahun 2014 Pasal 391 Pemerintah Daerah wajib menyediakan informasi Pemerintahan Daerah, yang dikelola dalam suatu sistem informasi Pemerintahan Daerah. Pasal 395 Pemerintah Daerah dapat menyediakan dan mengelola informasi Pemerintahan Daerah lainnya,” jelas Maurits.
Maurits menyampaikan Kemendagri mendorong pengembangan ekonomi kreatif sebagai mesin baru pertumbuhan ekonomi nasional. Upaya ini merupakan langkah strategis dalam rangka mewujudkan program prioritas Asta Cita Presiden Prabowo Subianto.
“Kemendagri sangat mendukung terciptanya pencapaian program pemerintah mengenai Strategi Nasional Keuangan Inklusif dan TPAKD. Langkah yang dilakukan dengan melaksanakan pembinaan dan pengawasan kepada pemerintahan daerah (pemda) secara umum dan khususnya di bidang pengelolaan keuangan daerah. Hal ini sebagaimana amanah Pasal 373 Undang-Undang Nomor 23 Tahun 2014 tentang Pemerintahan Daerah dan Pasal 216 Peraturan Pemerintah Nomor 12 Tahun 2019 tentang Pengelolaan Keuangan Daerah,” tegas Maurits.
Sejalan dengan itu guna mendorong pertumbuhan ekonomi dan percepatan inklusi keuangan di daerah serta pelaksanaan TPAKD, Maurits mendorong Pemda untuk mengoptimalkan realisasi Anggaran Pendapatan dan Belanja Daerah (APBD) Tahun Anggaran (TA) 2025 dan merealisasikan komitmen untuk belanja penggunaan produk dalam negeri dan penggunaan Kartu Kredit Pemerintah Daerah (KKPD) untuk mendukung peningkatan perekonomian di daerah.
“Strategi yang dapat dilakukan dengan segera adalah melakukan percepatan dan efektivitas program, kolaborasi dan sinergi program pemerintah melalui TPAKD dengan melibatkan berbagai pemangku kepentingan terkait termasuk berbagai tim yang ada di daerah seperti Tim Pengendali Inflasi Daerah (TPID) dan Tim Percepatan dan Perluasan Digitalisasi Daerah (TP2DD) menjadi strategis,” ujar Maurits.
Himpunan Pengusaha Muda Indonesia (Hipmi) menyambut baik 8 paket ekonomi yang dirilis pemerintah. Hal ini disebut bisa menjadi angin segar bagi pelaku usaha.
Sekretaris Jenderal Hipmi, Anggawira mengatakan guyuran insentif dengan nilai total Rp 16,23 triliun di 2025 ini bisa memudahkan pelaku usaha. Mengingat lagi adanya tantangan dinamika global dan kekhawatiran pelambatan ekonomi.
""Beberapa program yang diluncurkan mampu menjawab kebutuhan mendesak pelaku usaha muda maupun UMKM,"" kata Anggawira dalam keterangannya, Selasa (16/9/2026).
Misalnya, terkait dengan Pajak Penghasilan (PPh) 21 Ditanggung Pemerintah yang diperluas ke sektor pariwisata. 100 persen PPh 21 akan berlaku hingga Desember 2025. Anggawira memandang ini menjadi angin segar. ""Di sektor pariwisata dan F&B, insentif berupa keringanan pajak diyakini akan mendongkrak konsumsi domestik serta memperkuat daya saing,"" ujarnya.
Anggawira juga memandang adanya perlindungan sosial bagi pekerja bukan penerima upah, termasuk para pengemudi ojek online. Menurut dia, ini menunjukkan keberpihakan pada kelompok rentan.
Lalu, deregulasi serta integrasi RDTR digital ke dalam OSS dipandang sebagai langkah penting untuk mempercepat investasi dan mempermudah pengusaha muda memulai maupun mengembangkan usaha. ""Dukungan untuk UMKM dan gig economy di era digital juga dianggap sangat relevan agar pengusaha muda mampu bersaing, baik di pasar lokal maupun global,"" terangnya.",ok_site_specific,,False
"Korlantas Polri Evaluasi Penggunaan Sirene dan Rotator Patwal, Belum Terapkan Sanksi",Tidak Diketahui,https://www.liputan6.com/news/read/6165426/korlantas-polri-evaluasi-penggunaan-sirene-dan-rotator-patwal-belum-terapkan-sanksi,liputan6,2025-09-22 13:25:03+07:00,www.liputan6.com,"Liputan6.com, Jakarta - Korps Lalu Lintas (Korlantas) Polri masih melakukan evaluasi terhadap penggunaan sirene dan rotator kendaraan patroli pengawal atau patwal di jalan.
Meski telah memberikan imbauan tegas, belum ada penerapan sanksi bagi yang tidak mendengarkan arahan tersebut.
Metro Sepekan: Terkuak, Ini Motif Remaja 16 Tahun Aniaya Mahasiswi hingga Tewas di Indekos Ciracas Jaktim
Metro Sepekan: Terkuak, Ini Motif Remaja 16 Tahun Aniaya Mahasiswi hingga Tewas di Indekos Ciracas Jaktim
Dave Laksono Apresiasi Polri soal Pembekuan Penggunaan Strobo dan Sirine untuk Pengawalan
Dave Laksono Apresiasi Polri soal Pembekuan Penggunaan Strobo dan Sirine untuk Pengawalan
""Ada ketentuannya kapan digunakan dan kapan tidak digunakan. Tetapi manakala ini aspirasi dari masyarakat, untuk sementara pengawalan yang menggunakan sirene, strobo , ini kami bekukan. Sambil nanti kita evaluasi yang terbaik seperti apa,"" tutur Kakorlantas Polri Irjen Agus Suryonugroho di Auditorium PTIK, Jakarta Selatan, Senin (22/9/2025).
Menurutnya, evaluasi penggunaan sirene dan rotator akan melibatkan masyarakat dan para pakar. Kedepan, kata Agus, diskusi dilaksanakan untuk membahas tugas dan fungsi kepolisian dalam mewujudkan lalu lintas yang aman, selamat, tertib, dan lancar.
""Tentunya contohnya di tol pada saat patroli. Ini kan penting sekali bagaimana caranya pengguna jalan itu aman dan selamat. Tentunya juga harus ada patroli polisi. Ini akan kita evaluasi, dan kami terima kasih kepada masyarakat bahwa ternyata Polantas juga disenangin oleh masyarakat,"" terang Agus.
Ada pun soal sanksi, Agus belum menegaskan lebih jauh. Pihaknya sejauh ini masih menggunakan pendekatan persuasif, agar semua pihak dapat memahami keresahan masyarakat dan bijaksana saat bertindak.
""Kami tidak bangga untuk melakukan penegakan hukum. Tetapi kami mengimbau agar supaya mari kita jaga ketertiban bersama-sama,"" ucap dia.
""Hal-hal yang tidak baik dirasa oleh masyarakat, hal-hal yang tidak baik dirasa di perjalanan, polantas tidak akan mengedepankan penegakan hukum. Tetapi kami menghimbau kesadaran pribadi untuk kepentingan kita bersama,"" Agus menandaskan.
Sebelumnya, Komandan Pusat Polisi Militer (Danpuspom) TNI Mayjen TNI Yusri Nuryanto menegaskan akan menertibkan penggunaan strobo dan sirene, yang kerap dikenal dengan suara “tot tot wuk wuk”, oleh anggota TNI di jalan raya.
Yusri menekankan bahwa penertiban akan dilakukan berdasarkan aturan yang berlaku, guna menciptakan ketertiban dan kenyamanan bersama di jalan.
Hal ini disampaikan Yusri usai memimpin apel gelar pasukan Puspom TNI menjelang HUT ke-80 TNI di Lapangan Silang Monas, Jakarta Pusat.
""Kita sesuai dengan aturan aja ya biar lebih enak. Jadi, nanti kita akan di internal kita di TNI. Kami sudah sampaikan kepada masing-masing Danpuspom angkatan untuk menertibkan itu,"" kata Yusri kepada wartawan, Jakarta, Senin (22/9).
Dia juga menyoroti bahwa suara sirene yang keras dan penggunaan strobo secara sembarangan sering kali menimbulkan gangguan, bahkan bisa memancing emosi pengguna jalan lainnya.
""Terutama suara ini kadang-kadang cukup mengganggu dan memancing emosi. Kita akan menertibkan itu,"" tegasnya.
Yusri menegaskan bahwa pimpinan TNI, termasuk Panglima TNI Jenderal Agus Subiyanto, memberikan contoh langsung dalam hal kedisiplinan berlalu lintas. Dia memastikan bahwa Agus tidak menggunakan strobo maupun sirine dalam perjalanan dinasnya.
""Jadi, kemarin juga mungkin Bapak Panglima juga sudah memberikan statement. Karena Bapak Panglima sendiri tidak menggunakan itu. Jadi, mari kita contoh. Kita sesuai dengan aturan aja ya biar lebih enak,"" ujarnya.
Dia juga menegaskan bahwa penggunaan strobo dan sirine sudah diatur secara tegas dalam Undang-Undang Nomor 22 Tahun 2009 tentang Lalu Lintas dan Angkutan Jalan, khususnya dalam Pasal 134 dan 135. Dalam aturan tersebut, hanya kendaraan tertentu yang diizinkan menggunakan perangkat tersebut.
""Penggunaan strobo itu hanya diperuntukkan bagi ambulans, pemadam kebakaran, mobil jenazah, serta kendaraan pengawalan baik roda dua maupun roda empat,"" jelasnya.",ok_site_specific,,False
"Marak Penjiplakan dan Pemalsuan Produk, Ini Kiat untuk Pelaku Biar Tak Dirugikan",Tidak Diketahui,https://www.liputan6.com/bisnis/read/6164588/marak-penjiplakan-dan-pemalsuan-produk-ini-kiat-untuk-pelaku-biar-tak-dirugikan,liputan6,2025-09-21 05:00:54+07:00,www.liputan6.com,"Liputan6.com, Jakarta Aksi penjiplakan hingga pemalsuan produk masih menjadi sesuatu yang sangat merugikan sampai saat ini. Berdasarkan studi yang dirilis pada 2020 lalu menyatakan bahwa peredaran produk palsu telah menyebabkan kerugian negara mencapai Rp 291 triliun.
Bukan hanya merugikan dari segi angka, pemalsuan produk juga mengancam eksistensi suatu bisnis maupun bagi sebuah merek yang sudah ternama sekalipun..
“Pemalsuan dan penjiplakan produk, apa pun itu, sebetulnya bukan hanya merugikan bagi pemilik bisnis, tapi juga sangat merugikan konsumen karena apa yang didapatkan konsumen tidak sesuai dengan biaya yang sudah dikeluarkan,"" kata Founder PT Kutus Kutus Herbal Bambang Pranoto, Minggu (20/9/2025).
Sementara itu, agar para pelaku UMKM dapat bertahan meski harus bersaing dengan produk peniru maupun pemalsu di pasaran, CEO PT Kutus Kutus Herbal Riva Effrianti pun memberikan beberapa sarannya. Menurutnya, ada empat hal yang perlu dilakukan. Pertama, para pelaku usaha harus segera mendaftarkan merek dagangnya.
“Legalitas merek adalah perlindungan utama agar produk tidak mudah diklaim pihak lain,” tegasnya.
Kedua, Riva menerangkan pentingnya menjaga kualitas dan konsistensi produk. Menurutnya, produk berkualitas akan selalu dicari oleh konsumen dan tidak akan tergantikan. Konsumen akan tetap dapat merasakan kualitasnya dan membandingkannya meskipun banyak yang berusaha meniru.
Ketiga, Riva menekankan pentingnya bagi pelaku usaha agar tidak malas dan bosan mengedukasi konsumen. Menurutnya, penting bagi kita untuk menjelaskan bagaimana ciri-ciri produk kita yang asli dan bagaimana cara membedakannya dengan mudah.
“Untuk langkah yang keempat yaitu teruslah berinovasi. Peniru tidak akan bisa berinovasi. Mereka hanya akan berhenti di situ dan tidak akan lebih maju. Tapi kalau kita berinovasi, maka kita akan selalu selangkah lebih maju daripada mereka,” pungkas Riva.
Sebelumnya, peredaran obat bahan alam (OBA) illegal yang mengandung bahan kimia obat (BKO) masih jadi masalah serius di Indonesia. Menyadari risiko ini, Badan Pengawas Obat dan Makanan (BPOM) memperkuat upaya pencegahan dengan menggandeng Apoteker Praktik Herbal Indonesia (APHI) melalui pertemuan koordinasi daring pada Selasa (24/6/2025).
Direktur Cegah Tangkal BPOM, I Gusti Ngurah Bagus Kusuma Dewa, menegaskan bahwa kolaborasi pencegahan peredaran obat bahan alam ilegal ini bukan sekadar simbol kemitraan.
“Penggalangan ini adalah bagian dari ikhtiar sistematis membangun ekosistem perlindungan masyarakat terhadap kejahatan produk OBA,” ujarnya, dikutip dari laman resmi BPOM, Minggu (6/7).
Maraknya Jamu Ilegal dan Tantangan Pengawasan
Kasus jamu ilegal dengan kandungan BKO kian marak, apalagi di era digital. Produk jamu stamina, pelangsing, hingga penggemuk badan kerap diselipkan BKO seperti sildenafil, tadalafil, parasetamol, hingga sibutramin. Padahal, BKO seharusnya hanya digunakan di bawah pengawasan tenaga medis.
“Peredaran jamu ilegal mengandung BKO, khususnya melalui jalur digital, memerlukan pendekatan pencegahan dan deteksi dini berbasis risiko. Melalui perkuatan kerja sama ini, kami harap APHI dapat berkontribusi dalam edukasi, pemantauan mandiri, dan sistem cegah tangkal secara menyeluruh,” kata Bagus Kusuma Dewa.
APHI dinilai strategis karena anggotanya tersebar hampir di seluruh wilayah Indonesia, sehingga diharapkan mampu mendukung pengawasan dari hulu ke hilir.
Ketua Umum APHI, Apt. Kintoko, menyambut baik inisiatif BPOM. Menurutnya, edukasi publik menjadi kunci agar masyarakat tidak mudah tergiur dengan klaim jamu berlebihan.
“Penyebaran jamu ilegal juga dipicu oleh rendahnya literasi masyarakat terhadap herbal. Edukasi menyeluruh kepada keluarga sebagai konsumen utama menjadi sangat penting,” ujar Kintoko.
Sebagai organisasi sociopreneurship, APHI aktif melakukan pelatihan, riset, dan literasi publik terkait praktik herbal yang rasional. Sinergi dengan BPOM diharapkan mampu menguatkan pengawasan OBA ilegal, sekaligus mendorong citra jamu Indonesia yang aman dan bermutu.",ok_site_specific,,False
"Pelanggan Pindah ke SPBU Swasta, Bos Pertamina Curhat Begini",Tidak Diketahui,https://www.liputan6.com/bisnis/read/6164669/pelanggan-pindah-ke-spbu-swasta-bos-pertamina-curhat-begini,liputan6,2025-09-21 18:00:54+07:00,www.liputan6.com,"Liputan6.com, Jakarta Direktur Utama PT Pertamina (Persero) Simon Aloysius Mantiri menyadari adanya perpindahan pelanggan di SPBU Pertamina ke produk swasta. Namun, dia memastikan kualitas BBM di SPBU Pertamina tetap dalam kondisi yang terbaik.
Dia menyadari adanya perpindahan pelanggan itu sebagai imbas dari isu tata kelola hukum yang dihadapi perusahaan. Tapi, dia juga bekerja keras untuk bisa mengembalikan lagi kepercayaan konsumen BBM Pertamina .
PHE Fokus Cari Potensi Hidrokarbon di Cekungan Manui Sulawesi Tenggara
PHE Fokus Cari Potensi Hidrokarbon di Cekungan Manui Sulawesi Tenggara
Stok BBM di SPBU Swasta Bakal Tersedia Pekan Ini
Stok BBM di SPBU Swasta Bakal Tersedia Pekan Ini
Kementerian ESDM Turun Tangan Jika Pertamina dan Shell Cs Tak Temui Kesepakatan
Kementerian ESDM Turun Tangan Jika Pertamina dan Shell Cs Tak Temui Kesepakatan
""Tentunya harus kerja keras. Sekarang kan saya bilang, salah satu faktor penyumbang tentunya, ada trust issue dari masyarakat antara lain, kita sedang ada kasus tata kelola hukum. Kita ini semua, masyarakat sudah tahu,"" kata Simon di Istana Kepresidenan Jakarta, ditulis Sabtu (20/9/2025).
""Jadi kita juga terus menerus melakukan perbaikan di dalam tata kelola dan kita secara rutin melakukan sosialisasi bahwa yang sudah kami lakukan ini yang sebenarnya,"" sambungnya.
Pada konteks kualitas BBM, Simon juga tengah menggenjot peningkatan kapasitas produksi seperti kilang. Pengembangan Kilang Balikpapan misalnya, diharapkan mampu berkontribusi pada peningkatan kualitas BBM setara Euro 5.
""10 Ppm (tingkat kandungan) sulfurnya, jadi sangat rendah. Jadi tentunya kita terus menerus investasi juga ke arah sana. Meneruskan pekerjaan-pekerjaan yang sudah ada sebelumnya,"" tandasnya.
Sebelumnya, Direktur Utama PT Pertamina (Persero), Simon Aloysius Mantiri menegaskan pihaknya tidak akan mencari keuntungan sepihak dari kolaborasi dengan badan usaha swasta. Seluruh transaksi jual beli akan dilakukan secara terbuka.
Dia tidak berbicara banyak mengenai keuntungan yang akan diraup Pertamina. Dipastikannya BUMN tidak akan mengambil keuntungan dari kerja sama ini.
""Yang pasti saya juga tegaskan pada tadi ke semua, terbuka ke teman-teman dari Badan Usaha Swasta bahwa Pertamina juga tidak memanfaatkan situasi ini dan tidak mencari keuntungan di sini,"" tegas Simon di Istana Kepresidenan, Jakarta, ditulis Sabtu (20/9/2025).
Dia menjelaskan, skema bisnis yang akan dijalankan nantinya dlakukan secara terbuka. Seluruh biaya yang muncul dari proses pengadaan BBM, termasuk dari impor akan dibahas bersama.
Simon memberikan perhatian skema yang akan dijalankan ini agar tidak merubah harga jual BBM dari SPBU swasta di tingkat konsumen akhir.
""Jadi kita melihat cost-cost apa yang muncul kemudian diatur mekanisme secara business to business. Yang pasti jangan sampai membebankan dan nanti harga ke konsumen jadi lebih tinggi. Jadi kita harapkan harga ke konsumen tidak berubah,"" tuturnya.
Simon menuturkan, Pertamina saat ini mendapat mandat untuk menjaga ketahanan energi nasional. Termasuk meningkatkan produksi minyak bersama dengan Kontraktor Kontrak Kerja Sama (KKKS) lainnya.
Tugas ini yang menurutnya penting. Sehingga, kerja sama jual-beli BBM ke badan usaha swasta bukan semata mencari keuntungan sepihak.
""Jadi kalau ada kesempatan ini hanya diminta untuk kolaborasi dengan Pertamina tapi kami tidak memanfaatkan situasi dan ingin mencari keuntungan untuk kami, tidak,"" ucapnya.
""Tapi kita mekanisme kita lakukan dengan baik dan tentunya Badan Usaha Swasta juga bisa dapat sustainable operasionalnya dan tetap secara komersil tetap masuk,"" sambung Simon Aloysius Mantiri",ok_site_specific,,False
"Mengaku Pihak Leasing, 3 Mata Elang Perampas Motor Warga di Jakut Dibekuk Polisi",Tidak Diketahui,https://www.liputan6.com/news/read/6165010/mengaku-pihak-leasing-3-mata-elang-perampas-motor-warga-di-jakut-dibekuk-polisi,liputan6,2025-09-21 20:40:24+07:00,www.liputan6.com,"Liputan6.com, Jakarta - Polisi menangkap komplotan penagih utang atau mata elang berinisial YN, FL, dan IF setelah merampas dan membawa kabur motor milik korban bernama MDS di Jalan Raya Yos Sudarso, Kecamatan Kelapa Gading, Jakarta Utara , pada Jumat 19 Agustus 2025.
""Ketiga pelaku ini ditangkap di Jalan Raya Pulomas Pacuan Kuda pada Jumat usai dilakukan penyelidikan,"" kata Kapolsek Kelapa Gading Kompol Seto Handoko Putra di Jakarta, dikutip dari Antara , Minggu (21/9/2025).
Menguak Gudang Misterius Penyimpanan Motor Sitaan Debt Collector Matel di Depok
Menguak Gudang Misterius Penyimpanan Motor Sitaan Debt Collector Matel di Depok
Polisi Gerebek Gudang Penyimpanan Motor, Komplotan Mata Elang di Depok Tak Berkutik
Polisi Gerebek Gudang Penyimpanan Motor, Komplotan Mata Elang di Depok Tak Berkutik
Metro Sepekan: Pengakuan Mata Elang di Depok, Beli Data Warga Penunggak Kredit dan Berdalih Kerja Sesuai SOP
Metro Sepekan: Pengakuan Mata Elang di Depok, Beli Data Warga Penunggak Kredit dan Berdalih Kerja Sesuai SOP
Saat ini, ketiganya telah ditetapkan sebagai tersangka dan dijerat Pasal 378 KUHP tentang tindak pidana penipuan.
Adapun kejadian ini berawal saat korban MDS (21) dari ingin ke rumah rekannya di Cilincing, Jakarta Utara. Saat menuju arah jalan Yos Sudarso, korban dipepet tiga orang dengan dua motor.
Ketiga orang ini mengaku sebagai pihak ""leasing"" motor dan dengan modus motor tersebut bermasalah dengan tunggakan motor. Para pelaku mengatakan pihak ""leasing"" ingin mengambil motor tersebut.
Satu pelaku lalu membawa motor korban dan korban dibonceng, sesampai di Jalan Yos Sudarso pelaku FL membuang KTP dan STNK korban. Lalu korban ini turun motor mengambil dokumen tersebut. Pelaku langsung melarikan motor dan korban ditinggal di lokasi.
Mendapati informasi tersebut, Tim Opsnal Reserse Kriminal (Reskrim) Polsek Kelapa Gading melakukan penyelidikan terhadap pelaku dengan ciri-ciri yang sudah diketahui. Selain itu dilakukan patroli di wilayah yang sering terjadi aksi modus mata elang.
Setelah itu tim melakukan observasi wilayah dan membuntuti lima terduga pelaku modus matel tersebut. Setelah itu lima pelaku tersebut beraksi di Jalan Raya Yos Sudarso dan memepet korban.
Kelima pelaku tersebut menggunakan 3 motor matic. Setelah kelima pelaku tersebut beraksi dan mendapatkan motor korban setelah itu Tim Opsnal yg telah membuntuti pelaku tersebut langsung mengamankan tiga orang pelaku tersebut dan 2 orang pelaku tersebut berhasil melarikan diri.
Petugas melakukan penggeledahan badan ditemukan empat telepon seluler, dua unit sepeda motor dan satu sepeda motor merupakan motor yang diambil dari korban MBS.",ok_site_specific,,False
Mentan Amran Cerita Kena Vertigo Sampai Dirawat 7 Jam Gara-gara IniNews39 menit yang lalu,Tidak Diketahui,https://www.cnbcindonesia.com/news/20250922140811-4-669110/mentan-amran-cerita-kena-vertigo-sampai-dirawat-7-jam-gara-gara-ini,cnbc,2025-09-22 00:00:00+07:00,www.cnbcindonesia.com,"Mentan Amran Cerita Kena Vertigo Sampai Dirawat 7 Jam Gara-gara Ini
Jakarta, CNBC Indonesia - Menteri Pertanian (Mentan) Andi Amran Sulaiman bercerita bahwa dia pernah kena vertigo. Bahkan saat itu kondisinya sempat harus dirawat di rumah sakit selama 7 jam akibat pusing kepala.
Amran pun sesumbar mengungkapkan vertigo disebabkan karena target swasembada pangan oleh Presiden Prabowo Subianto dipercepat. Amran sebelumnya diberi target awal untuk mencapai swasembada pangan selama empat tahun.
Namun seiring berjalannya waktu, target selalu berubah dan kini Prabowo menargetkan swasembada pangan harus terealisasi dalam setahun.
""Awalnya kami diberi target Bapak Presiden soal swasembada pangan itu 4 tahun. Setelah 21 hari, beliau pidato di APEC dan G20, berhasil berubah target menjadi 3 tahun. Setelah 45 hari, beliau balik ke Indonesia, saya dipanggil menghadap jam 4 sore. Pak Mentan, bisa tidak swasembada 1 tahun? Kita mau bilang apa lagi? Kita sudah Menteri, tidak mungkin aku pertimbangkan. Atau kami usahakan. Maka saya jawab, ya Pak, siap 1 tahun,"" kata Amran dalam paparannya di rapat koordinasi (Rakor) Percepatan Pelaksanaan Program Hilirisasi Komoditas Perkebunan di kantor Kementerian Pertanian, Senin (22/9/2025).
Setelah dirinya mengiyakan permintaan Prabowo, dirinya mengaku mengalami vertigo karena memikirkan bagaimana cara agar swasembada pangan dapat terpenuhi satu tahun.
""Begitu kami sampaikan bahwa siap swasembada pangan 1 tahun, masuk Ramadan, H-2, kami kena vertigo. Muter ini kepala, 7 jam kami dirawat baru bisa bangun. Jadi itulah akibat tekanan. Jadi orang yang mau berhasil ternyata butuh tekanan,"" lanjut Amran.
Untuk mencapai target tersebut, Kementan melalukan kerja sama antara TNI, Polri, Bulog, hingga masyarakat. Alhasil, Indonesia berhasil menorehkan rekor baru dalam hal stok beras, di mana pada pertengahan tahun ini, stok beras nasional berhasil mencapai 4,2 juta ton.
""Berkat ini, salah satu capaian kita yang mengembirakan adalah stok beras kita tertinggi selama 59 tahun. Dulu kita impor, kini kita bisa stok hingga 4,2 juta ton. Itu semua karena kebijakan Bapak Presiden, gagasan besar Bapak Presiden,"" ungkapnya.
Tak hanya itu saja, sektor pertanian juga berhasil tumbuh 10,52% hingga pertengahan 2025. Masih soal beras, Badan Pusat Statistik (BPS) memperkirakan produksi beras nasional pada Oktober dapat mencapai 31 juta ton. Pada 2024 saja, produksi beras sudah mencapai 28 juta ton.
Sedangkan dari data internasional, Amran mengungkapkan United States Departement of Agriculture (USDA) memprediksi produksi beras Indonesia di 2025 mencapai 34,6 juta ton, melebihi target yang ditetapkan pemerintah sebesar 32 juta ton. Begitu juga Food and Agriculture (FAO), yang memprediksi produksi beras RI mencapai 35,6 juta ton pada tahun ini.
""FAO juga merilis, lompatan kita sekarang ini adalah tertinggi nomor 2 dunia setelah berhasil. Lompatannya produksi kita. Dan Indonesia masuk pemain utama pangan Dunia. Begitu juga USDA,"" ujarnya lagi.
Amran menyebut keberhasilan tersebut merupakan buah dari perjuangan keras semua pihak, terutama yang berkaitan dengan pertanian.
""Ini hasil kerja kita semua. Akhirnya kita bisa mencapai keberhasilan ini,"" pungkasnya.
(wur/wur)
[Gambas:Video CNBC]
Next Article Mentan Amran Bongkar Ada yang Tak Suka RI Swasembada Pangan, Siapa?",ok_trafilatura,,False
