judul_berita,penulis_berita,url_berita,media_online,tanggal_berita_dt,source_domain,artikel_berita,status,error,is_empty
"Gunung Marapi Meletus Lagi Minggu Sore, Warga Diminta Jauhi Radius 3 Kilometer",Tidak Diketahui,https://www.liputan6.com/news/read/6164940/gunung-marapi-meletus-lagi-minggu-sore-warga-diminta-jauhi-radius-3-kilometer,liputan6,2025-09-21 17:41:50+07:00,www.liputan6.com,"Liputan6.com, Jakarta - Gunung Marapi yang berada di Kabupaten Agam dan Kabupaten Tanah Datar, Provinsi Sumatera Barat dilaporkan mengalami erupsi pada Minggu (21/9/2025) sore pukul 16.36 WIB. Letusan ini tercatat sebagai erupsi kedua setelah sebelumnya terjadi pada pukul 13.28 WIB.
Gunung Marapi Meletus Lagi, Kolom Abu Membumbung 1.200 Meter ke Langit
Gunung Marapi Meletus Lagi, Kolom Abu Membumbung 1.200 Meter ke Langit
Gunung Marapi Erupsi Setinggi 1.600 Meter, Waspada Radius Bahaya!
Gunung Marapi Erupsi Setinggi 1.600 Meter, Waspada Radius Bahaya!
Gunung Marapi Erupsi Selasa Pagi, Abu Vulkanik Menyembur Setinggi 1.600 Meter
Gunung Marapi Erupsi Selasa Pagi, Abu Vulkanik Menyembur Setinggi 1.600 Meter
""Terjadi erupsi Gunung Marapi di Sumatera Barat pukul 16.36 WIB namun tinggi kolom abu tidak teramati karena tertutup awan,"" kata petugas PGA Gunung Marapi Teguh Purnomo di Padang, seperti dikutip dari Antara .
Berdasarkan data PGA, letusan kedua terekam di seismogram dengan amplitudo maksimum 7,3 milimeter serta berdurasi sekitar 53 detik.
Saat ini, Gunung Marapi masih berstatus Waspada atau Level II. Pusat Vulkanologi dan Mitigasi Bencana Geologi (PVMBG) mengeluarkan sejumlah rekomendasi antara lain melarang masyarakat, wisatawan, atau pengunjung berkegiatan di dalam radius tiga kilometer dari pusat aktivitas (Kawah Verbeek).
PVMBG juga mengingatkan ancaman potensi lahar dingin, terutama bagi masyarakat yang bermukim di sepanjang aliran sungai yang berhulu dari puncak gunung api.
Kondisi tersebut terutama saat terjadi hujan atau musim hujan. Kemudian, apabila terjadi hujan abu masyarakat diimbau menggunakan masker penutup hidung dan mulut guna menghindari gangguan saluran pernapasan.
Tidak hanya itu, apabila terjadi hujan abu masyarakat diimbau untuk menggunakan masker penutup hidung dan mulut untuk menghindari gangguan saluran pernapasan (ISPA).
PGA bersama PVMBG juga terus mengingatkan adanya tumpukan material akibat letusan gunung api tersebut yang menyebabkan munculnya aliran air dan sewaktu-waktu berpotensi terjadinya banjir lahar dingin.
Kondisi tersebut tidak bisa diabaikan karena sangat rentan dan berbahaya terutama saat hujan dengan intensitas tinggi. Hal yang paling mungkin terjadi yakni banjir lahar dingin seperti peristiwa 11 Mei 2024 yang menelan puluhan korban jiwa.",ok_site_specific,,False
Analisis Pengamat: Dua Alasan Strategis di Balik Pilihan Prabowo Tunjuk Djamari Sebagai Me...,Tidak Diketahui,https://www.liputan6.com/news/read/6164777/analisis-pengamat-dua-alasan-strategis-di-balik-pilihan-prabowo-tunjuk-djamari-sebagai-menko-polkam,liputan6,2025-09-21 12:09:40+07:00,www.liputan6.com,"Liputan6.com, Jakarta Presiden Prabowo Subianto resmi menunjuk menteri koordinator politik dan keamanan (Menko Polkam) pengganti Budi Gunawan. Dia adalah Djamari Chaniago, pensiunan perwira tinggi militer dengan pangkat jenderal bintang tiga.
Pengamat Politik dan Keamanan Universitas Paramadina, Febry Triantama menganalisis dua alasan kuat terkait penunjukan Djamari Chaniago sebagai Menko Polkam .
Sekolah Garuda Buka Pintu Pendidikan untuk Semua Kalangan, Termasuk Masyarakat Miskin
Sekolah Garuda Buka Pintu Pendidikan untuk Semua Kalangan, Termasuk Masyarakat Miskin
Prabowo Sampaikan Pidato di Sidang Majelis Umum PBB Hari Ini Pukul 20.00 WIB
Prabowo Sampaikan Pidato di Sidang Majelis Umum PBB Hari Ini Pukul 20.00 WIB
Di Forum PBB, Presiden Prabowo Ajak Dunia Akhiri Tragedi Gaza
Di Forum PBB, Presiden Prabowo Ajak Dunia Akhiri Tragedi Gaza
""Pertama, Djamari Chaniago merupakan sosok Purnawirawan Jenderal senior di TNI. Sebagaimana telah banyak disebut media, ia merupakan lulusan Akmil tahun 1971. Lebih senior dari Menhan Sjafrie Samsoeddin yang lulus tahun 1974,"" kata Febry melalui pesan tertulis, seperti dikutip Minggu (21/9/2025).
Senioritas dimiliki Djamari Chaniago turut didukung sederet pengalamannya sebagai panglima dalam memimpin pasukan. Hal itu diharapkan dapat menghadirkan sosok yang dihormati oleh seluruh pihak dan pada akhirnya memudahkan tugasnya dalam mengkoordinasikan instrumen keamanan negara.
""Alasan kedua, jika sebelumnya saya menyampaikan Presiden Prabowo pasti akan menunjuk orang terdekat dan kepercayaannya pada posisi Menko Polkam, sosok Djamari Chaniago menuhi prasyarat tersebut. Meski dulu menjadi bagian dari Dewan Kehormatan Perwira (DKP) yang memberhentikan Presiden Prabowo dari kedinasan di militer, sejarah tersebut tidak serta mengakibatkan keduanya memiliki hubungan yang tidak baik,"" ungkap Febry.
Febry menyebut, hal itu dibuktikan dengan keterlibatan Djamari Chaniago di Partai Gerindra sebagai kader, artinya berada di bawah kepemimpinan ketua umum Prabowo Subianto. Selain itu, kedekatan dan kepercayaan Presiden kepada Djamari juga terlihat ketika Presiden menunjuknya sebagai anggota Dewan Gelar, Tanda Jasa, dan Tanda Kehormatan.
""Keputusan Presiden ini juga sekaligus meletakkan orang-orang kepercayaan dan terdekat Presiden Prabowo pada pos-pos sangat strategis yang diharapkan dapat memudahkan Presiden memastikan agenda penguatan postur pertahanan bisa berjalan maksimal dan sesuai keinginannya sejak lama,"" dia menandasi.",ok_site_specific,,False
Habiburokhman Beri Penghargaan ke Aipda Marsidon di Hari Lalu Lintas Bhayangkara Ke-70,Tidak Diketahui,https://news.detik.com/berita/d-8124520/habiburokhman-beri-penghargaan-ke-aipda-marsidon-di-hari-lalu-lintas-bhayangkara-ke-70,detik,2025-09-27 00:00:00+07:00,news.detik.com,"Ketua Komisi III DPR RI Habiburokhman mewakili pemberian penghargaan kepada Aipda Marsidon Debataraja. Penghargaan itu diberikan atas dedikasi Aipda Marsidon sebagai Polantas berdedikasi.
Pemberian penghargaan dilakukan dalam acara syukuran Hari Lalu Lintas Bhayangkara ke-70 di Auditorium Mutiara STIK/PTIK, Jakarta Selatan, Senin (22/9/2025). Aipda Marsidon menerima penghargaan itu dari Habiburokhman.
Habiburokhman dan Aipda Marsidon terlihat saling berjabat tangan. Aipda Marsidon pun tampak tersenyum.
SCROLL TO CONTINUE WITH CONTENT
Hadir dalam acara tersebut Kapolri Jenderal Listyo Sigit Prabowo, Wakapolri Komjen Dedi Prasetyo, Kakorlantas Polri Irjen Agus Suryonugroho, Menhub Dudy Purwagandhi, Ketua MKD DPR RI Nazaruddin Dek, Dirjen Perhubungan Darat Kemenhub Irjen Aan Suhanan, Dirjen Bina Keuda Kemendagri Agus Fatoni, Komisioner Kompolnas Choirul Anam, Dirut Jasa Marga Rivan Achmad Purwantono, dan plt Dirut Jasa Raharja Dewi Aryani Suzana.
Hadir pula para pejabat utama Mabes Polri, komunitas pengemudi ojek online (ojol), dan masyarakat.
Sebagai informasi, Aipda Marsidon Debataraja menjadi korban penembakan oleh orang tak dikenal (OTK) dan terluka di bagian dada. Insiden itu terjadi saat Marsidon sedang mengantar korban kecelakaan lalu lintas ke RSUD Wamena, Jayawijaya, Papua.
Aipda Marsidon, yang ditemani rekannya, Aipda Bakri Sidikun, saat itu mengantar korban kecelakaan dari Jalan JB Wenas pada Rabu (28/5), pukul 19.14 WIT. Saat hendak kembali ke Polres, pengendara motor tiba-tiba muncul melepaskan tembakan ke arah Marsidon.
Tembakan tersebut menyebabkan Marsidon menderita luka tembak hingga langsung dilarikan ke dalam RSUD Wamena. Pihak kepolisian juga telah melakukan olah tempat kejadian perkara (TKP) dan mengamankan 4 selongsong peluru kaliber 5,56 mm.
Video: DPR Tunda Dulu Bahas RUU KUHAP: Masa Sidang Hanya 25 Hari Kerja
Video: DPR Tunda Dulu Bahas RUU KUHAP: Masa Sidang Hanya 25 Hari Kerja",ok_site_specific,,False
Pramono Anung Bakal Evaluasi TransJakarta Pasca Serangkaian Kecelakaan Sebulan Terakhir,Tidak Diketahui,https://www.liputan6.com/news/read/6164948/pramono-anung-bakal-evaluasi-transjakarta-pasca-serangkaian-kecelakaan-sebulan-terakhir,liputan6,2025-09-21 18:30:04+07:00,www.liputan6.com,"Liputan6.com, Jakarta - Gubernur Jakarta Pramono Anung bersuara soal maraknya kecelakaan bus TransJakarta . Tercatat, ada tiga kali peristiwa dalam sebulan terakhir. Menurut dia, hal itu tidak bisa dibiarkan dan harus dievaluasi.
""Kami mengevaluasi terhadap TransJakarta ,"" ujar Pramono kepada awak media saat ditemui dalam acara ASN RUN di Kementerian Pendidikan Dasar dan Menengah, Jakarta Pusat, Minggu (21/9/2025).
TransJakarta Gandeng KNKT untuk Identifikasi Buntut Kecelakaan yang Berulang
TransJakarta Gandeng KNKT untuk Identifikasi Buntut Kecelakaan yang Berulang
Gubernur Jakarta Pramono Anung menilai, insiden tidak bisa sepenuhnya menyalahkan juru kemudi TransJakarta. Sebab terkadang, kata dia, ada saja kendaraan yang masuk dan memotong jalur bus TransJakarta sehingga insiden tidak nahas terjadi.
""Sehingga dengan demikian, tentunya akan kami perbaiki. Gak boleh terjadi lagi,"" terang Pramono Anung .
Dia berjanji, TransJakarta akan berbenah dan akan memberi aman kepada para pelanggannya.
""Sekarang ini betul-betul Transjakarta, kenaikan orang menggunakan Transjakarta sudah naik secara signifikan. Karena memang saya mendorong untuk penggunaan transportasi publik itu meningkat,"" Pramono menandasi.
Sebagai informasi, berikut catatan peristiwa kecelakaan bus TransJakarta dalam sebulan terakhir:
1. Kecelakaan di di Setiabudi, Menteng Atas, Jakarta Selatan pada 6 September 2025.
Pada peristiwa tersebut, bus TransJakarta menabrak bangunan toko di Jalan Raya Minangkabau, Setiabudi, Menteng. Seorang penjaga toko menjadi korban luka dan dilarikan ke rumah sakit terdekat. Pihak
TransJakarta memastikan bakal menanggung seluruh biaya perawatan korban.
2. Kecelakaan dengan truk di Cideng, Gambir, Jakarta Pusat pada 18 September 2025.
Pada peristiwa tersebut, bus TransJakarta bertabrakan dengan truk di depan RSUD Tarakan.
3. Kecelakaan di Pulogebang, Cakung pada 19 September 2025.
Pada persiriwa ini, bus menabrak empat rumah toko (ruko) di Pulogebang, Cakung, Jakarta Timur. Persitiwa nahas itu terjadi sekitar pukul 05.30 WIB.
Sebanyak 6 orang menjadi korban luka yang terdiri dari 4 penumpang dan 1 sopir (pramudi), dan 1 warga. Berdasarkan investigasi, kecelakan diduga disebabkan karena rem blong, sehingga sopir kesulitan mengendalikan arah dan bus melaju lurus hingga menabrak bangunan dan kendaraan.
Sebelumnya, Gubernur DKI Jakarta, Pramono Anung, meninjau lokasi pertanian vertikal Ladang Farm di Cilandak, Jakarta Selatan, Kamis (18/9/2025). Kunjungan ini merupakan bagian dari upaya Pemerintah Provinsi (Pemprov) DKI Jakarta mendukung pengembangan urban farming.
Pramono mengaku tahu keberadaan Ladang Farm milik warga Cilandak tersebut dari media sosial. Menurutnya, kebun ini bukan hanya inovatif dan kreatif, namun juga mampu memproduksi tanaman hidroponik hingga dua ton per bulan.
""Kreativitas seperti ini luar biasa, karena mampu membuka lapangan kerja bagi warga. Lebih dari itu, hasil panennya sepenuhnya dibeli oleh berbagai restoran di Jakarta,"" kata Pramono.
Pramono menilai, berbagai jenis tanaman yang dapat dibudidayakan di pertanian vertikal seperti Thai basil, Italian basil, mint, selada, hingga shiso/perilla. Kebun ini menggunakan sistem hidroponik modern dengan rak bertingkat setinggi 13 meter dan memiliki 33.000 lubang tanam.
Ia menyebut, dengan kapasitas produksi yang cukup besar, Pemprov DKI Jakarta bakal memberikan dukungan bagi keberlanjutan operasional urban farming ini. Salah satunya dengan rencana penyediaan panel surya untuk memenuhi kebutuhan energi.
""Memang salah satu kendala utama adalah biaya listrik. Saat ini, semua operasional masih bergantung pada listrik konvensional yang cukup mahal. Karena itu, saya minta jajaran Pemprov mempelajari kemungkinan penggunaan panel surya. Kalau bisa diterapkan, saya kira ini akan sangat baik,"" ungkapnya.
Pramono berharap, kehadiran Pemprov DKI Jakarta dalam Ladang Farm bisa membantu memperluas promosi produk panen, sehingga dapat lebih dikenal masyarakat sebagai bagian dari alternatif pertanian modern di perkotaan.
""Walaupun tenaga kerja yang diserap masih terbatas, ide dan gagasannya yang patut diapresiasi. Karena itu, saya meminta jajaran untuk mempelajari lebih jauh hambatan yang mereka hadapi agar bisa kita dukung,"" ucap dia.
Data dari Dinas Ketahanan Pangan, Kelautan, dan Pertanian (KPKP) DKI Jakarta, jumlah pelaku urban farming di Jakarta saat ini mencapai 5.910 orang dengan 521 kelompok tani.
Dari sisi kebijakan, Pemprov DKI Jakarta juga telah menyusun peta jalan pengembangan urban farming berbasis ruang melalui Desain Besar Pertanian Perkotaan 2018–2030.
Program ini bertujuan memenuhi kebutuhan pangan keluarga, mengurangi pengeluaran rumah tangga, menambah pendapatan, menyerap tenaga kerja, mengendalikan inflasi, sekaligus menjaga kelestarian lingkungan dan tanaman asli Jakarta.",ok_site_specific,,False
"Bocah Perempuan Tewas Tergeletak di Kamar Kos Jakut, Kondisinya Mengenaskan Ada Ceceran Da...",Tidak Diketahui,https://www.liputan6.com/news/read/6165452/bocah-perempuan-tewas-tergeletak-di-kamar-kos-jakut-kondisinya-mengenaskan-ada-ceceran-darah-di-lantai,liputan6,2025-09-22 13:47:29+07:00,www.liputan6.com,"Liputan6.com, Jakarta Seorang bocah perempuan ditemukan meninggal dunia di kamar kos lantai tiga, Jalan Arwana Raya, Penjaringan , Jakut. Polisi pun turun tangan melakukan penyelidikan.
Kapolsek Metro Penjaringan, AKBP Agus Ady Wijaya menerangkan korban diketahui berinisial AR (8). Saat ditemukan, tubuhnya sudah membusuk, posisi terlentang, ada temuan ceceran darah yang mengering di sekitaran lantai. Kondisi kamar pun berantakan.
""Benar, kami mendapatkan informasi dari Bhabinkamtibmas Aiptu Mastawan, pada hari Minggu, 21 September 2025, pukul 00.00 WIB,"" kata dia dalam keterangannya, Senin (22/9/2025).
Unit Reskrim Polsek Penjaringan bersama Tim Ident Polres Jakut langsung turun tangan melakukan olah TKP hingga pukul 04.00 WIB dan dilanjutkan pemasangan garis polisi. Tak hanya itu, barang barang yang diduga berkaitan dengan kasus ini turut disita.
""Tim Ident Polres Jakut juga mengambil beberapa barang di TKP yang kuat diduga sebagai bukti, yang dapat menjadi petunjuk untuk mengungkap peristiwa,"" ucap dia.
Hingga kini, lima saksi dari penghuni kos sudah diperiksa. ""Kami juga mencari tahu kedua orang tua dari jenazah, dan sudah diketahui Ayah S (42) dan Ibu MKR (35),"" ucap dia.
Kini, jenazah AR sudah dibawa ke RS Polri Kramat Jati untuk diautopsi karena kondisi mayat sudah membusuk sehingga permukaan luar tubuh jenazah sulit dianalisa kasat mata.
""Kami juga sedang menunggu hasil autopsi,"" ucap dia.
Kapolres Metro Jakut juga menginstruksikan untuk dibentuk tim gabungan polres–polsek guna mengungkap kasus ini secara tuntas berbasis crime scene investigation.
Pihaknya juga mengamankan bukti CCTV di sekitaran TKP dan berkoordinasi dengan Laboratorium Forensik, Digital Forensik dan Psikologi Forensik untuk mendukung upaya penyelidikan dan penyidikan.",ok_site_specific,,False
"Soal Perpres Kenaikan Gaji ASN hingga Pejabat, Menkeu Purbaya Bilang Begini",Tidak Diketahui,https://www.liputan6.com/bisnis/read/6164905/soal-perpres-kenaikan-gaji-asn-hingga-pejabat-menkeu-purbaya-bilang-begini,liputan6,2025-09-21 16:30:23+07:00,www.liputan6.com,"Liputan6.com, Jakarta Kabar gembira bagi Aparatur Sipil Negara (ASN) di Indonesia. Pemerintah akan menaikan gaji ASN atau Pegawai Negeri Sipil (PNS), Pegawai Pemerintah dengan Perjanjian Kerja (PPPK), Tentara Nasional Indonesia (TNI), dan Kepolisian Negara Republik Indonesia (Polri) hingga pejabat negara.
Rencana kenaikan gaji ASN dan lain-lainnya ini menjadi salah satu poin yang tertuang dalam Peraturan Presiden atau Perpres Nomor 79 Tahun 2025 mengenai Pemutakhiran Rencana Kerja Pemerintah (RKP) 2025.
""Dokumen pemutakhiran Rencana Kerja Pemerintah Tahun 2025 merupakan bagian dari dokumen sebagaimana diatur dalam Peraturan Presiden Nomor 109 Tahun 2024 tentang Rencana Kerja Pemerintah Tahun 2025 yang telah dimutakhirkan berdasarkan Undang-Undang Nomor 62 Tahun 2024 tentang Anggaran Pendapatan dan Belanja Negara Tahun Anggaran 2025,"" demikian seperti dikutip dari pasal 1 RKP Tahun 2025.
Pada perubahan RKP 2025 dalam Perpres 79 Tahun 2025 menyebutkan tahapan pertama dalam Rencana Pembangunan Jangka Panjang Nasional (RPJN) 2025-2045 dan penjabaran tahun pertama Rencana Pembangunan Jangka Menengah Nasional (RPJMN) 2025-2029, estafet pembangunan perlu dilakukan secara akseleratif untuk menjaga kesinambangunan kemajuan bangsa Indonesia.
“Untuk menjaga kesinambungan kemajuan bangsa Indonesia. Oleh karena itu, pada RKP Tahun 2025 disusun 83 Kegiatan Prioritas Utama yang menjadi penekanan, termasuk di dalamnya delapan Program Hasil Terbaik Cepat, yang memuat inisiatif untuk menghasilkan output signifikan dalam mencapai sasaran pembangunan nasional,” demikian seperti dikutip dari lampiran RKP Tahun 2025 itu.
Dalam pemutrakhiran RKP 2025 pada delapan program hasil terbaik cepat itu, Presiden Prabowo menaikkan gaji ASN terutama guru, dosen, tenaga kesehatan dan penyuluh, TNI/Polri dan pejabat negara.
Lantas apa kata Menteri Keuangan (Menkeu) Purbaya Yudhi Sadewa soal Perpres Nomor 79 Tahun 2025 terkait kenaikan gaji ASN dan pejabat negara?
Purbaya mengatakan, pihaknya masih akan mempelajari soal rencana kenaikan gaji ASN dan pejabat dalam Perpres Nomor 79 Tahun 2025.
""Saya belum bisa jawab. Saya pelajari dulu ya,"" kata dia.
Purbaya bahkan berkelakar jika ada kenaikan gaji bagi ASN dan pejabat negara, artinya gajinya sebagai menteri keuangan juga ikut naik.
""Berarti saya naik gajinya kalau gitu. Boleh juga nih,"" tutur Purbaya dengan nada bercanda.
Pada 2024 lalu, pemerintah telah menaikan gaji ASN . Kenaikan gaji pokok PNS diatur melalui Peraturan Pemerintah (PP) Nomor 5 Tahun 2024 dan Peraturan Presiden (Perpres) Nomor 10 Tahun 2024. Sementara itu, penyesuaian gaji pokok PPPK diatur dalam Perpres Nomor 11 Tahun 2024. Anggota TNI dan Polri juga merasakan kenaikan ini, yang diatur dalam PP Nomor 6 Tahun 2024.
Secara umum, besaran kenaikan gaji pokok untuk PNS, PPPK, TNI, dan Polri adalah sebesar 8%. Hal ini memastikan bahwa seluruh abdi negara dapat merasakan dampak positif dari kebijakan ini sejak awal tahun.
Berikut adalah contoh rincian gaji pokok terbaru berdasarkan golongan, belum termasuk tunjangan lainnya:
Gaji Pokok PPPK (Perpres Nomor 11 Tahun 2024): Golongan I (0 tahun MKG): Rp 1.938.500 Golongan V (0 tahun MKG): Rp 2.511.500 Golongan IX (0 tahun MKG): Rp 3.203.600 Golongan XVII (0 tahun MKG): Rp 4.462.500
Golongan I (0 tahun MKG): Rp 1.938.500
Golongan V (0 tahun MKG): Rp 2.511.500
Golongan IX (0 tahun MKG): Rp 3.203.600
Golongan XVII (0 tahun MKG): Rp 4.462.500
Gaji Pokok PNS (PP Nomor 5 Tahun 2024): Golongan IA: Rp 1.685.700 - Rp 2.522.600 Golongan IIA: Rp 2.184.000 - Rp 3.643.400 Golongan IIIA: Rp 2.785.700 - Rp 4.575.200 Golongan IVA: Rp 3.287.800 - Rp 5.399.900
Golongan IA: Rp 1.685.700 - Rp 2.522.600
Golongan IIA: Rp 2.184.000 - Rp 3.643.400
Golongan IIIA: Rp 2.785.700 - Rp 4.575.200
Golongan IVA: Rp 3.287.800 - Rp 5.399.900
Sebelumnya, Presiden Prabowo Subianto telah mengesahkan Peraturan Presiden (Perpres) Nomor 79 Tahun 2025 pada 30 Juni 2025. Regulasi ini merupakan pemutakhiran dari Rencana Kerja Pemerintah (RKP) Tahun 2025, menggantikan Perpres Nomor 109 Tahun 2024.
""Dokumen pemutakhiran Rencana Kerja Pemerintah Tahun 2025 merupakan bagian dari dokumen sebagaimana diatur dalam Peraturan Presiden Nomor 109 Tahun 2024 tentang Rencana Kerja Pemerintah Tahun 2025 yang telah dimutakhirkan berdasarkan Undang-Undang Nomor 62 Tahun 2024 tentang Anggaran Pendapatan dan Belanja Negara Tahun Anggaran 2025,"" demikian seperti dikutip dari pasal 1 RKP Tahun 2025.
Pada perubahan RKP 2025 dalam Perpres 79 Tahun 2025 menyebutkan tahapan pertama dalam Rencana Pembangunan Jangka Panjang Nasional (RPJN) 2025-2045 dan penjabaran tahun pertama Rencana Pembangunan Jangka Menengah Nasional (RPJMN) 2025-2029, estafet pembangunan perlu dilakukan secara akseleratif untuk menjaga kesinambangunan kemajuan bangsa Indonesia.
“Untuk menjaga kesinambungan kemajuan bangsa Indonesia. Oleh karena itu, pada RKP Tahun 2025 disusun 83 Kegiatan Prioritas Utama yang menjadi penekanan, termasuk di dalamnya delapan Program Hasil Terbaik Cepat, yang memuat inisiatif untuk menghasilkan output signifikan dalam mencapai sasaran pembangunan nasional,” demikian seperti dikutip dari lampiran RKP Tahun 2025 itu.
Dalam pemutrakhiran RKP 2025 pada delapan program hasil terbaik cepat itu, Presiden Prabowo menaikkan gaji ASN terutama guru, dosen, tenaga kesehatan dan penyuluh, TNI/Polri dan pejabat negara.
Berikut 8 Program Hasil Terbaik Cepat dalam Rencana Kerja Pemerintah (RKP) Tahun 2025:
1. Memberi Makan Siang dan Susu Gratis di sekolah dan pesantren serta bantuan gizi untuk anak balita dan ibu hamil.
2.Menyelenggarakan pemeriksaan kesehatan gratis, menuntaskan kasus TBC dan membangun rumah sakit lengkap berkualitas di kabupaten
3.Mencetak dan meningkatkan produktivitas lahan pertanian dengan lumbung pangan desa, daerah dan nasional
4.Membangun sekolah-sekolah unggul terintegrasi di setiap kabupaten dan memperbaiki sekolah-sekolah yang perlu renovasi
5.Melanjutkan dan menambahkan program kartu-kartu kesejahteraan sosial serta kartu usaha untuk menghilangkan kemiskinan absolut
6.Menaikkan gaji ASN terutama guru, dosen, tenaga kesehatan dan penyuluh, TNI/Polri dan pejabat negara.
7.Melanjutkan pembangunan infrastruktur desa dan kelurahan, bantuan langsung tunai (BLT) dan menjamin penyediaan rumah murah bersanitasi baik untuk yang membutuhkan terutama generasi milenial, generasi Z dan masyarakat berpenghasilan rendah (MBR),
8.Mendirikan Badan Penerimaan Negara (BPN) dan meningkatkan rasio penerimaan negara terhadap produk domestik bruto (PDB) ke 23%.
Sementara itu, dalam Peraturan Presiden Republik Indonesia Nomor 109 Tahun 2024 terkait program hasil terbaik cepat pada poin enam hanya menyebutkan menaikkan gaji ASN (terutama guru, dosen, tenaga kesehatan, dan penyuluh). TNI/Polri. Selain itu, poin delapan menyebutkan optimalisasi penerimaan negara.",ok_site_specific,,False
"Purbaya Kantongi Nama Penjual Rokok Ilegal di Bukalapak, Tokopedia, CsTech11 menit yang lalu",Tidak Diketahui,https://www.cnbcindonesia.com/tech/20250922152935-37-669152/purbaya-kantongi-nama-penjual-rokok-ilegal-di-bukalapak-tokopedia-cs,cnbc,2025-09-22 00:00:00+07:00,www.cnbcindonesia.com,"Purbaya Kantongi Nama Penjual Rokok Ilegal di Bukalapak, Tokopedia, Cs
Jakarta, CNBC Indonesia - Rokok ilegal tanpa cukai masih banyak beredar di ecommerce. Kementerian Keuangan dalam waktu dekat mulai akan menindak penjual rokok ilegal secara online berdasarkan data dari platform ecommerce.
Menteri Keuangan Purbaya Yudhi Sadewa mengatakan bahwa platform ecommerce sudah dipanggil terkait pedagang rokok ilegal di platform mereka.
Ia meminta agar platform mulai bertindak untuk membersihkan marketplace masing-masing dari penjual rokok ilegal.
""Kami sudah panggil marketplace Bukalapak, Tokopedia, Blibli, semua, untuk menjalankan untuk tidak mnengizinkan barang ilegal. Utamanya rokok, nanti yang lain juga,"" katanya.
Para platform, jelasnya, tadinya berkomitmen untuk menurunkan semua konten penjual rokok ilegal di platformnya mulai 1 Oktober 2025. Namun, dia meminta agar penghapusan dilakukan lebih cepat.
Selain itu, Kemenkeu juga akan menindak langsung pemilik akun yang menjual toko online berdasarkan data yang sudah dimiliki.
""Nanti mulai, kan sudah ketdeteksi siapa yang jual. Kami akan mulai tangkepin, yang sudah, mulai jual, jangan jual lagi,"" kata Purbaya.
Selain di ecommerce, Kemenkeu juga akan memburu para pemasok rokok ilegal dan pedagang offline yang menjual rokok ilegal.
""Kami akan kejar suppliernya, di warung juga, katanya ada yang jual per toples murah. Kami akan cek. Siapa pun jual rokok ilegal, saya akan datangi secara random,: kata Purbaya.
(dem/dem)
[Gambas:Video CNBC]
Next Article TikTok Shop & Tokopedia Punya 8 Juta Afiliator, Dorong UMKM Makin Cuan",ok_trafilatura,,False
