judul_berita,url_berita,tanggal_berita
"Moskow Diguyur Serangan Drone Besar-besaran Ukraina, Kilang Gazprom Kena Hantam 2 Kali dalam Sepekan",https://www.tribunnews.com/internasional/7733120/moskow-diguyur-serangan-drone-besar-besaran-ukraina-kilang-gazprom-kena-hantam-2-kali-dalam-sepekan,2025-09-24T21:01:00+07:00
"Demi Netanyahu, AS Ancam Lumpuhkan ICC: Sanksi Menyeluruh Bisa Bikin Pengadilan Mati Mesin",https://www.tribunnews.com/internasional/7733121/demi-netanyahu-as-ancam-lumpuhkan-icc-sanksi-menyeluruh-bisa-bikin-pengadilan-mati-mesin,2025-09-24T21:03:00+07:00
Hakim Tegur Legal Wilmar Group Beri Kesaksian Berubah-ubah Saat Sidang: Ada yang Saudara Sembunyikan,https://www.tribunnews.com/nasional/7733122/hakim-tegur-legal-wilmar-group-beri-kesaksian-berubah-ubah-saat-sidang-ada-yang-saudara-sembunyikan,2025-09-24T21:03:00+07:00
Shayne Pattynama dan Sandy Walsh Kompak Absen Perkuat Buriram United,https://www.tribunnews.com/superskor/7733123/shayne-pattynama-dan-sandy-walsh-kompak-absen-perkuat-buriram-united,2025-09-24T21:07:00+07:00
Pemerintah Tebar 52.400 Ton Jagung Pakan Murah ke 2.109 Peternak,https://www.tribunnews.com/bisnis/7733124/pemerintah-tebar-52400-ton-jagung-pakan-murah-ke-2109-peternak,2025-09-24T21:13:00+07:00
Polisi Kesulitan Identifikasi Pelaku Penganiayaan Karyawan Zaskia Adya Mecca: Motor Tanpa Pelat,https://www.tribunnews.com/metropolitan/7733125/polisi-kesulitan-identifikasi-pelaku-penganiayaan-karyawan-zaskia-adya-mecca-motor-tanpa-pelat,2025-09-24T21:15:00+07:00
Munas V Ikatan Alumni UPN Veteran Jakarta Tetapkan Ketua Umum Baru,https://www.tribunnews.com/nasional/7733126/munas-v-ikatan-alumni-upn-veteran-jakarta-tetapkan-ketua-umum-baru,2025-09-24T21:16:00+07:00
"Macet Total di Sekitar Gedung DPR RI Malam Ini, Polisi: Imbas Perbaikan Gerbang Tol Semanggi 1",https://www.tribunnews.com/metropolitan/7733127/macet-total-di-sekitar-gedung-dpr-ri-malam-ini-polisi-imbas-perbaikan-gerbang-tol-semanggi-1,2025-09-24T21:17:00+07:00
Pemerintah Bakal Gelar Akad Massal 25 Ribu Rumah Subsidi Pekan Depan,https://www.tribunnews.com/bisnis/7733128/pemerintah-bakal-gelar-akad-massal-25-ribu-rumah-subsidi-pekan-depan,2025-09-24T21:18:00+07:00
"Kecelakaan Tunggal di Kolaka Utara, Truk Tangki Terjun ke Jurang, Sopir Meninggal Dunia",https://www.tribunnews.com/regional/7733129/kecelakaan-tunggal-di-kolaka-utara-truk-tangki-terjun-ke-jurang-sopir-meninggal-dunia,2025-09-24T21:21:00+07:00
Rencana Dasco Bentuk Badan Pelaksana Reforma Agraria Dinilai Jadi Momentum Jawab Tuntutan Publik,https://www.tribunnews.com/nasional/7733130/rencana-dasco-bentuk-badan-pelaksana-reforma-agraria-dinilai-jadi-momentum-jawab-tuntutan-publik,2025-09-24T21:21:00+07:00
"Budi Gunawan dan Hendi Terpental dari Kabinet, Bagaimana Hubungan PDIP-Megawati dengan Prabowo?",https://www.tribunnews.com/nasional/7733131/budi-gunawan-dan-hendi-terpental-dari-kabinet-bagaimana-hubungan-pdip-megawati-dengan-prabowo,2025-09-24T21:27:00+07:00
"Temukan Adanya Pendana di Balik Demo Ricuh Akhir Agustus 2025, Bareskrim: Masih Proses Pembuktian",https://www.tribunnews.com/nasional/7733132/temukan-adanya-pendana-di-balik-demo-ricuh-akhir-agustus-2025-bareskrim-masih-proses-pembuktian,2025-09-24T21:29:00+07:00
Fraksi Golkar Terima Usulan Skema Hybrid Royalti Musik dari Piyu Padi,https://www.tribunnews.com/nasional/7733162/fraksi-golkar-terima-usulan-skema-hybrid-royalti-musik-dari-piyu-padi,2025-09-24T23:45:00+07:00
Pidato Presiden Prabowo di Sidang PBB Dinilai Cerminan Indonesia Terus Dukung Kemerdekaan Palestina,https://www.tribunnews.com/nasional/7733147/pidato-presiden-prabowo-di-sidang-pbb-dinilai-cerminan-indonesia-terus-dukung-kemerdekaan-palestina,2025-09-24T22:00:00+07:00
Cerita Siswi SMP Angela Margareth Soal Ide Atasi Sampah Organik di Pasar,https://www.tribunnews.com/nasional/7733144/cerita-siswi-smp-angela-margareth-soal-ide-atasi-sampah-organik-di-pasar,2025-09-24T21:55:00+07:00
"Hari Tani Nasional: Merawat Petani, Menjaga Negeri",https://www.tribunnews.com/tribunners/7733145/hari-tani-nasional-merawat-petani-menjaga-negeri,2025-09-24T21:57:00+07:00
"Detik-detik Suami Bunuh Istri di Kebon Jeruk Jakbar, Pelaku Emosi Korban Hendak Pergi ke Kendal",https://www.tribunnews.com/metropolitan/7733146/detik-detik-suami-bunuh-istri-di-kebon-jeruk-jakbar-pelaku-emosi-korban-hendak-pergi-ke-kendal,2025-09-24T21:58:00+07:00
"Rocky Gerung Sebut Prabowo Mulai Tampak Militeristik, Beda dengan SBY yang Juga Berlatar Militer",https://www.tribunnews.com/nasional/7733148/rocky-gerung-sebut-prabowo-mulai-tampak-militeristik-beda-dengan-sby-yang-juga-berlatar-militer,2025-09-24T22:01:00+07:00
Penyanyi Efah Aaralyn Bawakan Lagu 90'an 'Ingat Ingat Pesan Mama',https://www.tribunnews.com/seleb/7733149/penyanyi-efah-aaralyn-bawakan-lagu-90an-ingat-ingat-pesan-mama,2025-09-24T22:03:00+07:00
"Daftar 28 Pemain Timnas Indonesia di Ronde 4 Kualifikasi Piala Dunia: Marselino Out, Ole Comeback",https://www.tribunnews.com/superskor/7733150/daftar-28-pemain-timnas-indonesia-di-ronde-4-kualifikasi-piala-dunia-marselino-out-ole-comeback,2025-09-24T22:03:00+07:00
Dino Patti Djalal: Pidato Prabowo di PBB Kontras dengan Gaya Trump,https://www.tribunnews.com/nasional/7733151/dino-patti-djalal-pidato-prabowo-di-pbb-kontras-dengan-gaya-trump,2025-09-24T22:14:00+07:00
"Petugas Kebersihan Ditemukan Tewas di Selokan Dekat Polda Jateng, Sebelumnya Izin Tidak Masuk Kerja",https://www.tribunnews.com/regional/7733152/petugas-kebersihan-ditemukan-tewas-di-selokan-dekat-polda-jateng-sebelumnya-izin-tidak-masuk-kerja,2025-09-24T22:16:00+07:00
Apa Itu UTS Insearch yang Ada di Data Pendidikan Gibran Rakabuming Raka dan Dipersoalkan Roy Suryo?,https://www.tribunnews.com/nasional/7733153/apa-itu-uts-insearch-yang-ada-di-data-pendidikan-gibran-rakabuming-raka-dan-dipersoalkan-roy-suryo,2025-09-24T22:19:00+07:00
Jerman dan Swedia Kerahkan Jet Tempur Cegat Pesawat Pengintai IL-20M Rusia di Atas Laut Baltik,https://www.tribunnews.com/internasional/7733154/jerman-dan-swedia-kerahkan-jet-tempur-cegat-pesawat-pengintai-il-20m-rusia-di-atas-laut-baltik,2025-09-24T22:22:00+07:00
Kemendes Siap Tindaklanjuti Rekomendasi BPK Usai Raih WTP,https://www.tribunnews.com/nasional/7733155/kemendes-siap-tindaklanjuti-rekomendasi-bpk-usai-raih-wtp,2025-09-24T22:34:00+07:00
Kunci Jawaban Pendidikan Pancasila Kelas 5 SD Kurikulum Merdeka Halaman 124:  Satu Nusa Satu Bangsa,https://www.tribunnews.com/pendidikan/7733156/kunci-jawaban-pendidikan-pancasila-kelas-5-sd-kurikulum-merdeka-halaman-124-satu-nusa-satu-bangsa,2025-09-24T22:40:00+07:00
Mantan Duta Besar AS untuk NATO: Drone Rusia ke Polandia Adalah Tindakan Disengaja,https://www.tribunnews.com/internasional/7733157/mantan-duta-besar-as-untuk-nato-drone-rusia-ke-polandia-adalah-tindakan-disengaja,2025-09-24T22:40:00+07:00
Kemenko Polkam Bubarkan Desk Koordinasi Penanggulangan Karhutla,https://www.tribunnews.com/nasional/7733158/kemenko-polkam-bubarkan-desk-koordinasi-penanggulangan-karhutla,2025-09-24T23:06:00+07:00
Ekspor BBM Rusia Anjlok ke Level Terendah Gegara Ukraina Serang Besar-besaran Kilang Minyak Moskow,https://www.tribunnews.com/internasional/7733159/ekspor-bbm-rusia-anjlok-ke-level-terendah-gegara-ukraina-serang-besar-besaran-kilang-minyak-moskow,2025-09-24T23:10:00+07:00
"3 Fakta Baru Kasus Kematian Bocah Perempuan di Penjaringan, Ditemukan Luka Terbuka di Kepala",https://www.tribunnews.com/metropolitan/7733160/3-fakta-baru-kasus-kematian-bocah-perempuan-di-penjaringan-ditemukan-luka-terbuka-di-kepala,2025-09-24T23:25:00+07:00
Kapolri Libatkan Pakar dan Akademisi dalam Rapat Akselerasi Transformasi Polri,https://www.tribunnews.com/nasional/7733161/kapolri-libatkan-pakar-dan-akademisi-dalam-rapat-akselerasi-transformasi-polri,2025-09-24T23:40:00+07:00
"Angkat Derajat Cremonese, Pijakan Emil Audero Jadi Kiper Utama Timnas Indonesia di Ronde 4",https://www.tribunnews.com/superskor/7733104/angkat-derajat-cremonese-pijakan-emil-audero-jadi-kiper-utama-timnas-indonesia-di-ronde-4,2025-09-24T20:24:00+07:00
"5 Tips Memperbaiki Toxic Relationship, Segera Ubah",https://www.idntimes.com/life/relationship/5-tips-memperbaiki-toxic-relationship-segera-ubah-01-gxmly-qww385,2025-01-11T05:16:00+07:00
4 Tips Memperbaiki Bumper Mobil yang Penyok,https://www.idntimes.com/automotive/car/4-tips-memperbaiki-bumper-mobil-yang-penyok-c1c2-01-rbgc6-2x8syr,2024-11-04T16:40:00+07:00
"5 Tips Memperbaiki Hubungan Tanpa Putus, Jangan Biarkan Kandas!",https://www.idntimes.com/life/relationship/5-tips-memperbaiki-hubungan-tanpa-putus-jangan-biarkan-kandas-01-fkmt4-ygzk1c,2024-09-13T02:03:00+07:00
"7 Tips Memperbaiki Kondisi Keuangan yang Mulai Menipis, Wajib Tahu!",https://www.idntimes.com/men/attitude/7-tips-memperbaiki-kondisi-keuangan-yang-mulai-menipis-wajib-tahu-01-tg1j7-l3vdhh,2024-08-21T06:02:00+07:00
5 Tips Memperbaiki Hubungan yang Rusak Akibat Golden Child Syndrome,https://www.idntimes.com/life/family/5-tips-memperbaiki-hubungan-yang-rusak-akibat-golden-child-syndrome-01-fqxf8-mwr7b6,2025-01-09T20:12:00+07:00
"5 Tips Memperbaiki Hubungan yang Diuji oleh Kebohongan, Simak Ya!",https://www.idntimes.com/men/attitude/5-tips-memperbaiki-hubungan-yang-diuji-oleh-kebohongan-simak-ya-01-tg1j7-wv65bf,2025-04-04T13:02:00+07:00
Menkeu Purbaya Berencana  Kurangi Subsidi Listrik dan Beralih ke PLTS,https://www.idntimes.com/business/economy/menkeu-purbaya-berencana-kurangi-subsidi-listrik-dan-beralih-ke-plts-00-gshdq-m979x0,2025-09-20T22:10:00+07:00
CEK FAKTA: Purbaya Minta Rakyat Sumbang bila Ingin Ekonomi Maju?,https://www.idntimes.com/business/economy/cek-fakta-purbaya-minta-rakyat-sumbang-bila-ingin-ekonomi-maju-00-rgfwk-qn0ffz,2025-09-26T09:30:00+07:00
Purbaya: Tidak Ada Manipulasi pada Data Pertumbuhan Ekonomi Q2,https://www.idntimes.com/business/economy/purbaya-tidak-ada-manipulasi-pada-data-pertumbuhan-ekonomi-q2-00-gshdq-s4g41g,2025-09-22T16:45:00+07:00
Bos BSI Buka Suara Soal Titipan Dana Rp10 Triliun dari Menkeu Purbaya,https://www.idntimes.com/business/economy/bos-bsi-buka-suara-soal-titipan-dana-rp10-triliun-dari-menkeu-purbaya-00-bvq5c-wn60ws,2025-09-22T15:30:00+07:00
Menkeu Purbaya: Risiko Kredit Fiktif dalam Dana Rp200 T Tetap Ada,https://www.idntimes.com/business/economy/menkeu-purbaya-risiko-kredit-fiktif-dalam-dana-rp200-t-tetap-ada-00-gshdq-gyphns,2025-09-20T16:47:00+07:00
Koalisi Desak Purbaya Naikkan Tarif Cukai Rokok demi Kesehatan Masyarakat,https://www.idntimes.com/news/indonesia/koalisi-desak-purbaya-naikkan-tarif-cukai-rokok-demi-kesehatan-masyarakat-00-481xk-g8psbq,2025-09-23T15:38:00+07:00
"Kejar Pertumbuhan Ekonomi 8 Persen, Purbaya Terapkan Sumitronomics",https://www.idntimes.com/business/economy/kejar-pertumbuhan-ekonomi-8-persen-purbaya-terapkan-sumitronomics-00-jnnzw-z7btlp,2025-09-23T19:26:00+07:00
Efek The Fed hingga Purbaya Bikin Rupiah Melemah Hari Ini,https://www.idntimes.com/business/economy/efek-the-fed-hingga-purbaya-bikin-rupiah-melemah-hari-ini-00-bvq5c-t3dqj3,2025-09-22T15:59:00+07:00
"Profil Anggito Abimanyu, Wamenkeu yang Jadi Ketua LPS Gantikan Purbaya",https://www.idntimes.com/business/economy/profil-anggito-abimanyu-00-brqf5-pmdk36,2025-09-23T10:18:00+07:00
"Purbaya Buru 200 Penunggak Pajak Besar, Targetkan Dapat Rp60 Triliun",https://www.idntimes.com/business/economy/purbaya-buru-200-penunggak-pajak-besar-targetkan-dapat-rp60-triliun-00-brqf5-s30b21,2025-09-23T19:19:00+07:00
Penjelasan BGN Soal Keracunan Massal Siswa di Ketapang usai Santap Menu MBG Berbahan Ikan ...,https://www.liputan6.com/news/read/6169175/penjelasan-bgn-soal-keracunan-massal-siswa-di-ketapang-usai-santap-menu-mbg-berbahan-ikan-hiu,2025-09-26T10:31:44+07:00
Top 3 News: Istana Tanggapi Usulan Setop Sementara MBG Imbas Banyak Kasus Keracunan,https://www.liputan6.com/news/read/6168942/top-3-news-istana-tanggapi-usulan-setop-sementara-mbg-imbas-banyak-kasus-keracunan,2025-09-26T08:30:06+07:00
"Banyak Siswa Keracunan MBG, Cucun DPR: Jangan Program Visioner Ini Rusak Karena Lemahnya P...",https://www.liputan6.com/news/read/6169065/banyak-siswa-keracunan-mbg-cucun-dpr-jangan-program-visioner-ini-rusak-karena-lemahnya-pengawasan,2025-09-26T07:44:43+07:00
"Keracunan Massal MBG, Ahli Gizi Kritik Tata Kelola dan Keamanan Pangan",https://www.liputan6.com/news/read/6168881/keracunan-massal-mbg-ahli-gizi-kritik-tata-kelola-dan-keamanan-pangan,2025-09-26T01:35:21+07:00
"Kasus Keracunan MBG Marak, Pengelola Dapur Diminta Utamakan Kesehatan dan Kebersihan",https://www.liputan6.com/news/read/6169021/kasus-keracunan-mbg-marak-pengelola-dapur-diminta-utamakan-kesehatan-dan-kebersihan,2025-09-26T00:09:16+07:00
